recipeID,recipeName,calorie,recipeDescription
7678,incidunt,8,"Minima provident ipsam officiis doloribus. Quo aliquam nulla inventore quis. Sit sapiente amet aperiam distinctio. Voluptatem aspernatur ut ad nemo dolore quo sed est."
7686,minima,324820000,"Illo eaque facere accusamus necessitatibus vel architecto. Voluptate sint quasi laborum nam quibusdam quia et voluptatem. Quia ducimus nesciunt illum aut. Voluptatem ea sit ut et. Aliquam ea rerum earum recusandae laudantium minima neque."
7755,alias,3926,"Consectetur odio ex accusantium aut. Maiores minus excepturi expedita aut ut repellendus est. In qui quasi sed. Modi et molestias animi placeat iusto aspernatur. Saepe qui optio enim."
7908,nostrum,35686,"Odio aliquam quasi in et. Est dolore aut excepturi mollitia. Quisquam non aperiam occaecati sequi tempore sequi dolore. Sit mollitia est molestiae et odio."
7913,facilis,65012800,"Earum quis dolorum veritatis. Et ut voluptate temporibus recusandae vel. Sunt ducimus enim numquam. Esse porro totam necessitatibus veniam. Inventore aut perferendis rerum amet et excepturi rerum."
7920,et,0,"Labore minima tenetur ad nam impedit et minima consequatur. Dicta beatae sed ipsam debitis labore voluptatem. Neque fuga laboriosam occaecati blanditiis ex. Quisquam at non minima sapiente dignissimos corrupti eveniet ut."
7957,quo,1,"Qui quo numquam a voluptates reiciendis repudiandae similique. Sapiente exercitationem distinctio soluta quia sed. Doloribus et aliquam esse sint cum veniam. Natus sed voluptates iste hic. Et non reprehenderit quia consequatur quam quaerat atque cupiditate."
7963,itaque,178,"Voluptas ipsa quos et eveniet. Inventore fugiat dignissimos ut qui dolor iste. Dolor veritatis magni ratione doloribus recusandae accusantium laudantium officiis. Voluptatem a minima molestiae in harum laborum nobis."
8003,et,71446,"Soluta minus vel reiciendis quidem eveniet. Tempora occaecati minus illum consequatur distinctio. Vel consequatur dolor adipisci illum tempora sed vel dolore."
8096,aliquid,24,"Tempore rerum doloremque rerum. Aut ducimus praesentium soluta fugiat ex atque quia."
8151,cupiditate,4,"Et non dolorem cumque rerum dolorum officia. Minima ratione et enim vitae consequuntur at. Quis esse sed sint."
8328,quo,9,"Fugiat sit alias ullam molestiae repellat id est. Et ducimus occaecati sed eveniet."
8404,minima,79745600,"Mollitia dignissimos molestias aut odio. Sunt ut maiores rerum est. Illo dolor rerum unde tempora minus animi."
8614,et,175173000,"Eum harum accusamus sed quia dicta. Esse quia commodi omnis. Voluptates est laboriosam iusto accusamus quasi quia. Aut et assumenda voluptates accusamus sit. Et vitae illo animi quis nihil quia natus."
8636,omnis,39593,"Dolorum fugiat veritatis nihil voluptatem. Sed non molestiae suscipit et nam aut ad. Non voluptates repellendus sunt tempore."
8807,dolores,0,"Dicta dolor repudiandae qui molestias. Velit sapiente eaque suscipit. Consequatur aut voluptas consequuntur labore et recusandae laboriosam et. Iste nemo et libero id exercitationem."
8817,corporis,752086000,"Ut neque ut est enim. Molestias reiciendis architecto aut alias qui. Ad dolores aliquid adipisci nobis aut et dolorem. Aut tempora sunt quaerat."
8888,inventore,0,"Tempore quod excepturi iste ut labore. Odit quo tenetur velit mollitia sed cupiditate. Ex et nulla mollitia veritatis expedita iste."
8960,perferendis,93905,"Quaerat modi aperiam eveniet nam perferendis ea. Accusantium quo ab nesciunt vel nesciunt hic ea facilis. Laborum maxime rerum consequuntur aperiam quis a illo."
8966,magni,9,"Quo eos temporibus voluptates corporis est qui. Sunt id veniam ea veritatis."
9000,asperiores,25390600,"A aut incidunt aut voluptas suscipit rerum. Alias libero qui quam. Adipisci beatae molestiae consequuntur laborum eius et fugit. Qui quia quae amet qui doloremque facilis repellat dolor."
9106,aperiam,31511,"Necessitatibus vitae facilis nihil ipsa. Officiis excepturi commodi dolorem architecto nobis eum. Adipisci labore est quo qui beatae."
9254,tempore,124977,"Maxime repellat voluptas accusantium quibusdam id animi. Et facere deserunt aperiam inventore pariatur dolor. Voluptatem soluta exercitationem non eius quia nihil autem omnis. Voluptatem saepe et eveniet occaecati est."
9321,quod,7,"Nisi fugit eius sit autem impedit. Enim ipsa rerum pariatur ut voluptas atque. Ea architecto corporis suscipit et ex ut."
9356,fuga,583863000,"Voluptates fugit et eveniet est dolor occaecati. Eum quae molestias modi sunt cupiditate nisi. Eligendi quidem molestiae officiis aliquam reprehenderit molestiae omnis. Quam dolore rerum architecto quia earum. Officiis ex eos laboriosam in."
9470,autem,3335,"Neque minima quo explicabo dolor pariatur omnis. Eum vel error tenetur est minima. Non vel sed est optio aut nihil totam. Quia aut temporibus rem earum molestiae qui sunt."
9471,quibusdam,52,"Et ut ullam voluptatem. Consequatur similique nesciunt cupiditate ea dicta cumque. Ea alias molestiae omnis qui enim. Voluptatum sunt dignissimos dolor et."
9498,dicta,0,"Magnam deleniti voluptas dolorem quibusdam voluptatem. Nesciunt voluptate qui enim. Soluta distinctio illum ut tenetur recusandae sit excepturi."
9599,omnis,72,"Aliquid rerum rerum sit temporibus. Praesentium totam voluptatem ipsum numquam ut aut magni. Nisi et perferendis hic quidem."
9607,voluptas,0,"Placeat incidunt dolores aut laboriosam autem. Ut aut reiciendis ea velit iure eligendi aliquid. Commodi tempore et et error. Et ad et et aut fuga rerum similique id."
9830,odio,2424640,"Aut nisi inventore perferendis quaerat. Et nulla dolorum porro blanditiis eos ullam. Cumque eaque aut optio pariatur ab expedita animi odio. Fugiat tempore autem sequi eius consequatur."
9927,et,0,"Omnis voluptates unde distinctio quasi est accusamus. Non sit voluptate illum et aspernatur. Vel non facere qui vitae."
9948,quos,815738000,"Ea eum exercitationem quis laboriosam. Natus autem iste sunt velit error. Beatae dicta est tempora autem necessitatibus possimus."
10687,delectus,3108,"Doloremque eligendi blanditiis in iusto explicabo. Voluptas atque impedit sunt reiciendis ut. Eum provident impedit incidunt assumenda aliquam nemo maiores. Provident accusantium quos id aut quibusdam ex."
10759,laudantium,980484000,"Sequi fugit reprehenderit nam voluptatem aliquam asperiores nulla. Iste suscipit sit tenetur numquam dolorem molestiae commodi. In non et autem incidunt dolores sit."
10865,qui,225437000,"Asperiores magnam qui quasi cum est. Et quae itaque quo et quia. Qui voluptate ipsum dolor inventore ullam nihil et."
10998,accusantium,691339,"Quibusdam minima odio dolores quam voluptate magni. Facilis eos quibusdam voluptates quaerat atque corporis reprehenderit. Non asperiores animi itaque officia. Sequi blanditiis ab qui dignissimos et ut atque."
12069,aliquam,3,"Consequatur vel repudiandae ad. Porro ipsa architecto aperiam. Corrupti sint cum occaecati eum. Corporis suscipit perferendis maxime dolores."
12080,aspernatur,0,"Error provident voluptates ullam a. Sunt quam voluptatem voluptates. Iste recusandae repellat soluta sunt dolorem ea."
12159,earum,118029000,"Est nihil voluptatem a ea. Pariatur dolore tempore quasi laborum non ullam. Sint quo labore dicta dolore."
13371,ut,549713000,"Possimus recusandae iusto quo qui earum et recusandae. Incidunt nulla dolores et quas corporis. Est dolor quia delectus ut."
14919,sequi,988120000,"Quaerat amet sint ullam necessitatibus velit. Velit eaque saepe molestiae ea reiciendis sint ipsa. Odio dicta minus quia atque."
15657,amet,55292900,"Sunt et qui ipsa beatae quam. Aut omnis ducimus qui quas. Nihil consequuntur voluptas quia soluta repellendus aut sint. Quidem quas magnam repellendus sit id."
19474,neque,0,"Similique ducimus illo praesentium asperiores. Omnis perferendis rerum voluptatem cumque. Nobis provident repellendus quia qui. In qui perspiciatis totam recusandae occaecati et ipsum."
20223,quo,5,"Dolor quo quasi animi dolores minus et rerum quod. Consequuntur veniam inventore ut error optio laudantium. Nihil voluptatum soluta earum dolor aliquam. Quia eius incidunt rerum architecto veritatis et placeat."
20903,eum,52068000,"Ex aut qui unde molestiae vel optio minus asperiores. Aspernatur consequatur sint fugiat officia nam."
21428,quibusdam,120,"Quis ducimus id ut dolores labore odit nihil ad. Cumque debitis omnis occaecati dolor commodi quam eos ea. Quia unde a saepe aliquam. Quia possimus quisquam ut a expedita."
21569,velit,13710,"Voluptate aliquam magnam qui quod voluptatibus voluptates. Sit aut quisquam ipsum est eum voluptas. Quia beatae voluptatibus quos quos aut explicabo. Et asperiores voluptatem et iste."
21953,consequatur,733279000,"Dolorum aliquam assumenda non totam architecto at. Sequi modi suscipit minima qui aspernatur ipsam quia. Molestias doloremque tempore architecto nostrum."
22494,qui,6091550,"Sit eligendi hic ipsa aliquam qui vel maiores. A corporis et voluptas dolor rem iusto quia. Impedit et quas quia cupiditate. Facilis cumque harum nostrum error."
23210,itaque,45049,"Voluptatem voluptatibus minima aut quisquam odio eos sed. Sit voluptas iste corrupti harum nihil non. Ducimus expedita vel necessitatibus magni. Eum autem nemo deleniti ea nostrum."
24876,ut,513575000,"Dolores consequatur inventore molestiae ut doloremque et necessitatibus. Et qui vel perspiciatis laboriosam rerum. Natus delectus ab ullam ut maiores. Dolorem aperiam quaerat facilis."
26474,dolorem,9043160,"Inventore maiores nihil sit quidem omnis velit. Ipsum perferendis officiis sit sed quia in. Sapiente ex ut qui debitis rem aut dolorem. Et odio non temporibus sed sed aut."
27104,atque,3525,"Quae earum aliquid molestiae consequatur est. Modi est enim id ut quam temporibus nemo. Ab et quis voluptatum dicta voluptas."
27632,quidem,3,"Voluptatum quam aut esse dolores quisquam. Tenetur quis voluptate rerum aspernatur soluta. Explicabo non doloribus eius non rerum quia et. Et repellat et aliquid quia."
27842,aut,42323,"Eius ut optio iste necessitatibus. Aut qui reiciendis ipsam praesentium quia exercitationem sed. Incidunt fugiat deleniti qui est. Excepturi ipsa et ad aut."
28263,laboriosam,7,"Modi deserunt voluptas quo aspernatur similique eligendi. Voluptates neque est veritatis optio quo. Voluptatem delectus ipsam animi est molestiae at. Velit eos incidunt sunt enim vel dolor."
28383,quia,975017000,"Tempora eum et ipsa nobis minus. Dolor ut asperiores quia. Eos sed odit fuga atque. At iusto hic sint in."
29840,doloremque,4329160,"Vitae minima quis sequi. Corporis ipsa est et ipsa. Vero aut illo deserunt quisquam dolores sit et."
29864,aut,72,"Sapiente qui qui officia qui ut quasi suscipit sit. Est reiciendis quaerat sint animi ab."
30239,rerum,54,"Aut voluptatibus quia dolores nisi dignissimos. Sed et sit blanditiis quasi aliquam. Accusantium velit sapiente consectetur dolores. Omnis placeat veniam neque maiores in."
30654,iusto,0,"Sequi doloremque facilis ut doloribus sed in ipsa. Voluptate nisi distinctio distinctio qui nulla. Excepturi sit enim voluptas. Delectus aspernatur omnis maxime fuga omnis corrupti blanditiis fuga."
30742,nobis,61294000,"Eveniet ut consequuntur quis perferendis facere. Optio voluptate suscipit illum. Culpa aut praesentium numquam mollitia fugit id qui. Eos doloribus non ipsum. Omnis nulla voluptate sunt magnam animi."
31001,itaque,3741370,"Quia deleniti qui fugit ratione. Odit commodi maiores dolorum porro non dolor qui. Earum neque repudiandae soluta perspiciatis ut ipsum officia. Eius accusantium saepe at dolores ullam voluptas."
31070,veniam,496588000,"Ea quia soluta aut. Minus illo officia atque numquam asperiores qui quo. Quod illum exercitationem voluptas harum autem. Sunt fugit dolores hic."
32377,quasi,85,"Doloremque inventore aut veniam ut reprehenderit fugiat. Voluptas temporibus porro aliquam reiciendis saepe. Magnam mollitia et natus ex."
32533,voluptas,576848,"Et eligendi necessitatibus incidunt. Accusantium eum dolores dolor fuga. Repellendus reiciendis nobis ut aut."
32747,dicta,483005000,"Eos accusamus delectus sit culpa quos aperiam. Earum minima libero perferendis fugit. Quibusdam tempore ducimus ipsa omnis sit pariatur labore sed. Sit perspiciatis commodi rerum debitis sunt rerum sint."
33470,perferendis,2719,"Consequatur vero debitis officiis dolorem accusantium sed. Odio reiciendis eius blanditiis dolore. Rerum eos asperiores aliquid excepturi placeat."
34336,inventore,7,"Aut perferendis autem praesentium tempore voluptatibus. Est sit voluptatibus est inventore a in voluptas. Quod quasi molestiae sint consequatur aut corporis fugiat. Magni ipsum aut quae voluptate eos illum provident."
35489,architecto,15781,"Quod cum consequatur est. Velit praesentium error laudantium corporis sequi at perspiciatis. Saepe neque dolore laudantium ullam omnis asperiores deserunt. Sunt ullam sed voluptatem numquam sint molestiae in."
36611,libero,81894,"Molestiae optio nostrum reiciendis animi numquam iusto. Eos quae repellendus ut qui porro voluptate. Neque natus perspiciatis aut deserunt."
37148,hic,40,"Ut distinctio enim veritatis illo. Qui facere ut et voluptatem ut sed molestiae. Similique laborum impedit molestiae rerum facere. Soluta vel et vero aut."
37238,ad,60918700,"Quia delectus ut aut quidem officia harum. Assumenda distinctio in voluptatem quia. Nisi ipsam consequatur laborum molestias aut quia. Maiores fuga et aliquam sunt consequatur est culpa."
40066,sapiente,52161,"Est ducimus natus qui reiciendis voluptates nemo esse saepe. Itaque laudantium optio rerum blanditiis quisquam laborum officiis numquam."
41384,enim,279,"Eligendi libero autem voluptatem et quia sunt cumque. Animi exercitationem consequuntur hic voluptate ea ut accusamus. Quia asperiores sed qui in voluptas. Illum voluptas ut qui nulla quos sapiente eveniet. Qui odio sequi aut atque."
42153,et,6245220,"Eius molestias illo voluptas asperiores qui dolorem. Harum suscipit vel architecto possimus est."
43324,nihil,0,"Illo molestias sed esse aut ipsa. Dolores vel atque est officiis. Autem delectus ut labore blanditiis et. Temporibus voluptatem velit officiis laborum et aut."
43332,natus,0,"Corporis consequatur iure quos qui quae. Ut sunt reprehenderit voluptas qui. Et aliquam aut sint suscipit minima. Quis enim harum nihil est."
43786,accusantium,414243000,"Quia quo quo tempora veniam optio et. Pariatur tempore porro minus qui nihil. Voluptas voluptate molestias corporis et aut molestiae occaecati. Tempora mollitia voluptate numquam laborum quam laborum voluptatem. Quia ratione illum nisi possimus et."
45835,vel,86267300,"Iusto doloribus odio at labore consequuntur ea id at. Maiores sed occaecati velit facere. Quae enim optio non totam ut et sint dolorum. Nulla et ut laboriosam vitae quisquam fugiat minus. Voluptatem voluptatem ut ad."
46348,fugiat,960062,"Possimus suscipit deserunt voluptatem labore libero earum praesentium et. Iusto et incidunt ut accusamus sint. Qui est qui doloribus velit ab molestiae. Quia ut quas cumque."
48305,suscipit,29790700,"Aliquam hic eum nulla voluptatem. Asperiores et accusamus impedit. Autem tempora quaerat nobis recusandae ipsum amet natus. Tenetur velit consequatur corrupti tempore vitae accusantium."
49086,dignissimos,26781,"Ut reprehenderit temporibus ea omnis. Adipisci molestiae non nulla deleniti omnis. Voluptatem vitae inventore placeat alias optio. Nostrum et minima quo est soluta."
49417,tempore,365338,"Modi inventore quia corrupti non incidunt et. Quod sed perspiciatis voluptatibus non fuga perspiciatis. Quisquam illo id eaque nihil tempora accusantium. Minima sequi reprehenderit omnis molestias et ex."
49920,ullam,914791000,"Vitae est quia a molestiae occaecati. Quaerat qui corrupti voluptates rerum illo dolorum sit. Aspernatur voluptatem cupiditate ducimus sapiente quas in. Commodi iure et voluptatibus esse. Sequi animi consectetur sapiente culpa nihil fuga."
50016,consequatur,491,"Laudantium id necessitatibus doloremque odio labore. Rerum adipisci nihil quis optio est reiciendis excepturi porro. Recusandae accusantium deserunt excepturi aut eos aut repellat. Porro ut qui sint eos officia soluta."
50535,qui,88644700,"Molestiae quod omnis fugit provident officia. Ab eius odit ut nam sit. In aut similique ea eum accusamus. Maxime voluptatem qui possimus ducimus."
52021,animi,15,"Libero eum ipsam et cumque. Aut est atque error corrupti. Porro et impedit nisi assumenda voluptatem natus."
52433,cum,959095,"Esse sed veniam sequi et sint mollitia. Hic est id ut quo nostrum sint sit. Hic sequi voluptas a eos ad quo dolorem. Qui laboriosam et facere omnis molestiae vitae libero. Quia laborum sed aut est."
52809,ducimus,2,"Voluptatem aliquid voluptas adipisci aspernatur laborum qui qui. Necessitatibus facilis et quis in. Voluptatibus recusandae at libero quia sit."
52894,occaecati,8661110,"Minus voluptatem aliquid rerum aspernatur temporibus reprehenderit beatae. Deserunt et illum facere dolores iure dolor. Mollitia sunt corporis quasi dolore."
53987,quas,4,"Esse consequatur vel minima. Ut et sit omnis sit recusandae fugit aperiam. Velit porro dolor at quia nisi voluptatem a. Aperiam perspiciatis dolor qui optio."
54572,doloribus,211,"Exercitationem perferendis quos omnis voluptatem. Aspernatur tempore maxime quia est quibusdam mollitia vel. Quia illo error ut. Rem ipsa aperiam nobis voluptas similique sed aliquid. Culpa voluptates in et mollitia quam et."
55506,et,0,"Amet nisi aut sed. Enim occaecati id vel voluptates voluptatem laborum assumenda. Magni fugiat minus molestiae velit."
56175,iste,68419900,"Vitae tempore iusto mollitia. Et officia aut tenetur sed quis quos nulla. Ullam corporis aperiam deleniti quia expedita ipsam ut voluptatem. Dolorem qui ut qui et cupiditate molestiae aut. Officiis repellat cupiditate minima eos."
57682,hic,880615000,"Quia non quo incidunt enim esse voluptate consequatur. Voluptatem aut inventore est at commodi repellat ab. Velit totam non tenetur ducimus non soluta."
57917,a,7226750,"Dolor harum eveniet distinctio recusandae cum. Est velit alias ipsum sed eum laborum magnam. Eligendi qui repudiandae eligendi. At repellendus et quia consequatur."
58512,quo,342440,"Neque aut possimus occaecati nam quas temporibus voluptates ratione. Natus illum qui molestiae dolorem nisi. Eum vero magni enim natus nihil aut illo. Necessitatibus voluptas consectetur sed maxime suscipit similique."
58607,possimus,2763800,"Facere laboriosam aspernatur nisi totam. Suscipit ratione cumque voluptas. Dolor eum labore commodi harum beatae."
59393,voluptatem,20461,"Excepturi omnis qui accusantium culpa fugit. Voluptatibus iusto mollitia inventore ut molestiae excepturi amet voluptas. Corporis voluptatem possimus a mollitia. Tempore fugiat nemo non fugiat. Consequuntur molestias molestiae rerum amet in."
61209,architecto,32606,"Fugiat earum debitis quia neque. Beatae aut placeat consequatur et voluptate dolorem. Repudiandae qui et dolorem voluptatem alias nam. Beatae quia autem suscipit nihil vitae voluptatem error voluptatum."
61574,dolores,0,"Quo exercitationem non illo voluptas officia ipsam. Beatae magnam illum qui officia. Sint aut qui repudiandae totam facilis sequi repellat quae."
61711,corporis,4,"Consequatur aperiam ducimus quibusdam. Et error perspiciatis nihil laudantium aut. Eveniet placeat omnis eos quod ipsam quidem atque."
61951,sit,1350,"Non facilis iure sequi sequi rerum qui et voluptas. Quo dolor possimus illo porro. Assumenda praesentium illo possimus ullam et tempore."
62254,aut,357537000,"Dignissimos alias voluptatem rerum. Dolorem minus temporibus impedit ea. Ea deserunt voluptas sed commodi excepturi labore mollitia et."
64031,dolor,7310,"Voluptas pariatur et quia eveniet illo et accusamus. Expedita sint placeat error inventore qui. Qui odit provident neque et accusantium natus. Quisquam in non amet ea ut velit quibusdam."
64312,ut,9693580,"Autem animi libero consequuntur corporis inventore expedita et quibusdam. Vero quidem veritatis nostrum ea reprehenderit voluptatem. Omnis mollitia nam itaque odio officiis. Vel mollitia molestias est totam aspernatur at."
64475,et,65452500,"Qui eos unde id dolores repellendus dicta. Dicta perferendis optio perspiciatis eaque odit nam doloremque consequatur. Sed qui nisi cupiditate rem voluptas. Veritatis aliquam vero eius laborum."
64596,commodi,5,"Voluptates et cum quo maiores necessitatibus. Aliquam quia aut suscipit quibusdam. Minus quidem et facilis porro. Tempora iure non consequatur a voluptatem et ab."
66321,sapiente,229,"Mollitia reiciendis adipisci quia explicabo ut. Animi reprehenderit soluta eaque blanditiis non recusandae accusamus. Unde provident voluptas sed aliquam eos odit blanditiis."
67137,necessitatibus,65,"Aut et ut optio nostrum minus voluptas sit placeat. Recusandae dolores nulla et soluta velit expedita. Molestiae expedita minus repellendus aut tempore eligendi officia excepturi."
67529,dolores,6539,"Dolorem quaerat quidem accusamus veritatis ipsa iure aut. Ratione adipisci vitae porro molestias dolores neque impedit. Neque sit alias dolorem ad asperiores rerum pariatur. Aut ipsam iste nesciunt assumenda."
68403,corporis,7,"Est ratione assumenda sequi eaque. Modi voluptas sint inventore rerum iusto molestiae. Nostrum natus sed impedit rerum. Quasi in minima nihil perferendis."
69878,laboriosam,0,"Neque dolor dolor tenetur. Velit aliquid hic sint rerum libero quae reiciendis. Laboriosam consequatur rerum libero sapiente numquam in."
69923,nisi,2242,"Quia nihil impedit nesciunt debitis nisi. Et debitis sapiente sunt assumenda molestias provident. Aliquid distinctio doloremque commodi impedit. Iste accusantium magnam ut maxime."
70061,ea,0,"Molestiae occaecati architecto quibusdam qui natus nihil maiores maxime. Maxime illo vero quaerat ea optio provident ullam. Laborum alias veniam repellat quis et eaque. Ut qui nisi ut laboriosam."
70312,sunt,352670,"Omnis sunt ea et omnis consequatur dolor. At dicta dicta nostrum sed et alias. Blanditiis eum corporis voluptatem commodi saepe repellat. Corrupti quae quibusdam alias illo sapiente voluptatem."
70968,voluptates,0,"Praesentium reprehenderit voluptatibus cumque ut consequatur consequuntur et ut. Perspiciatis animi perspiciatis aspernatur mollitia qui aspernatur. Ipsum et est sint et adipisci magni quia doloribus. Aperiam non a ullam numquam deserunt. Aliquam aliquid id voluptatem molestias quasi et non."
72536,quibusdam,513,"Optio sit eos ipsum voluptas sint minima aliquam. Est magni ut doloremque iure id voluptatum velit ut. Voluptatem non quam est architecto nemo."
73772,mollitia,9,"Odio vero dignissimos ducimus vitae in repellat vel. Unde qui sunt incidunt dolor est non qui. Et modi eaque sit quisquam."
74088,consequuntur,5496,"Ex eaque ut et sequi et. Est dignissimos ut consequatur. Sunt non odit cumque unde. Sed reprehenderit vitae animi hic officiis. Ut vel et dolor quas dicta animi explicabo."
75510,incidunt,1516,"Dolores vel officia aut deleniti repudiandae. Omnis qui corporis in dolorem qui voluptas."
75575,tenetur,2,"Ipsam dignissimos debitis ut quia corporis. Numquam iste vel nihil quas. Quibusdam delectus non ut sit. Illo quia vel dolorem id distinctio cum. Nihil omnis non maiores est quia."
76075,ea,11072,"Ipsum nobis ipsa aut cumque minus. Iusto eum veniam quo vitae dolorum corrupti ut numquam. Eligendi esse temporibus qui sapiente dicta assumenda."
77741,nihil,641,"Aut excepturi ut qui natus. Velit porro quas quas. Porro rem molestias quod quidem quia perferendis. Aut voluptas aliquam quas est consequuntur non sed."
78026,omnis,901,"Ut error reprehenderit quae impedit. Molestias nihil deserunt necessitatibus est rerum qui. Eum quia nisi maiores itaque."
78526,aut,47271900,"Eos nam et magni occaecati cum minima. Molestias sed dicta atque."
80467,eos,6585830,"Minus et dolore qui est consectetur. Voluptatem quia porro aut sit est. Aut voluptate illum fuga harum quae optio assumenda. Et beatae rerum atque temporibus voluptatem."
80556,officia,349703000,"Sapiente quisquam et rerum molestiae omnis ut. Quidem nesciunt consequatur dolor aut cum excepturi. Rerum repellat sequi totam minima hic quia. Voluptatem non voluptatem ipsa autem nisi quis. Consequatur corporis temporibus minima aut commodi accusantium recusandae quaerat."
80879,omnis,521826000,"Sequi vel recusandae nisi corporis quia eveniet non. Aut in sunt veritatis nulla nihil. Impedit quasi beatae facere itaque ipsum quo architecto. Voluptatem rerum consectetur ipsa fugit vitae."
81024,minus,7,"Exercitationem unde consequuntur perspiciatis reprehenderit ut et at. Quis nesciunt ut saepe quis quod commodi dolor. Voluptatum id sit quae quo eius voluptas. Omnis ea mollitia mollitia eum."
81818,quaerat,38,"Aliquam et facere ut tempora perspiciatis. Nulla numquam minus in omnis. Cum ex consectetur sit harum ratione et."
81870,mollitia,0,"Dolores repellendus quia consectetur sequi. Nostrum pariatur nulla reprehenderit. Voluptatem illum asperiores eius enim aspernatur neque. Voluptatem voluptas vitae ut quae expedita illo."
82244,fugiat,74837,"Tenetur beatae repellat mollitia veniam voluptatibus. Necessitatibus voluptatibus tempora deleniti enim soluta laborum. Praesentium iusto doloremque unde enim quos aut quis necessitatibus."
82820,sint,0,"Autem non nobis accusamus officiis voluptas eos error. Atque libero qui est quasi quisquam harum."
83785,harum,76730200,"Eaque maxime commodi qui aut eligendi aperiam non. Dolor et ipsam similique deleniti beatae velit. Et aut in exercitationem porro."
84301,suscipit,761,"Omnis sint tempore et ut omnis. Iure adipisci aut qui facere ea. Et aperiam saepe veritatis ipsam aut voluptatibus. Explicabo saepe blanditiis aut aut doloribus hic at quas. Ea id nemo doloremque eos repudiandae qui."
84502,et,389216,"Sunt in pariatur voluptas ut. Explicabo libero odio quis necessitatibus. Ut occaecati praesentium molestiae id aut consequatur quasi."
84754,laborum,915,"Non suscipit eligendi et asperiores et. Id deserunt id assumenda."
