recipeID,recipeName,calorie,recipeDescription
8000224,pariatur,868219000,"Eius quaerat natus amet id. Voluptate beatae tenetur tenetur eos sequi molestias. Ut assumenda nulla voluptatum est sed nihil non aperiam. Voluptatum dolore ut ut id blanditiis incidunt consequuntur ea."
8028954,qui,80,"Ducimus cupiditate qui cum quis ducimus asperiores perferendis. Ut ea ducimus iste dolore. Ut nemo officiis tempore. Voluptas deleniti repudiandae ex nihil animi."
8068676,architecto,103158,"Enim voluptas sed et quia vero voluptas consequuntur vel. Modi magnam et ducimus eos. Facilis inventore soluta dolores consequuntur aut enim fugiat delectus."
8072610,ducimus,0,"Ut nobis numquam repellendus dolores dolorem sed. Temporibus nam ipsam esse aspernatur sed. Ratione blanditiis facilis pariatur consequatur deleniti. Ut sapiente rerum dolor assumenda. Reprehenderit quo tenetur totam eum eveniet est dolorum qui."
8098470,nulla,0,"Aspernatur autem delectus voluptas laborum doloremque molestias quidem. Ut fugit earum labore distinctio. Fugit ut asperiores quaerat vel reiciendis architecto magnam. Voluptatem repellat et accusamus atque animi labore. Quidem esse nihil ea illum dolor."
8121733,blanditiis,97,"Molestias corporis consequatur dignissimos tempore placeat ad. Nam ut saepe ut aut. Soluta blanditiis doloremque earum quibusdam quas autem."
8205654,voluptatem,79,"Tempore facere veritatis iste asperiores incidunt. Eius odio et maxime illo rerum aut eos. Qui consequuntur et dolore sit ratione et quod. Consequatur placeat sunt modi sed velit placeat nihil. Doloremque fuga laboriosam excepturi placeat."
8215200,mollitia,3268,"Debitis magni nihil enim vel est. Necessitatibus velit fugit eos perspiciatis illo quia est. Quaerat a est omnis enim ipsum. Atque maiores autem commodi ut porro earum."
8278636,quis,90,"Sed rerum culpa ut optio debitis porro aut. Soluta distinctio dolores accusamus non. Illo maiores ut sint distinctio voluptatum beatae necessitatibus. Aut dolor sit quasi voluptas qui."
8345949,doloremque,88664,"Molestiae dolor architecto non qui distinctio. Est totam earum tempora ipsam. Mollitia distinctio harum sunt quod impedit ab ut. Laudantium facilis omnis maiores sunt numquam maxime."
8367151,atque,46215,"Facilis qui facere eius nam beatae blanditiis. Ea qui aut minus voluptate. Aut soluta culpa omnis deserunt quisquam quia. Et corporis ad blanditiis dolor."
8398560,aspernatur,5010700,"Quia voluptatum ratione ea qui non culpa hic. Asperiores aspernatur tempore quod voluptate harum qui rerum et. Et deleniti nobis aliquid distinctio neque nesciunt."
8425435,quisquam,39800,"Magni molestiae architecto neque repudiandae rerum. Veritatis dolores vel aut non sit fuga quia. Debitis officia non accusamus nihil sapiente odit. Quia atque ratione molestiae officia aut sed."
8636688,repellendus,63092000,"Sed corporis ducimus soluta quo. Impedit dolor dolorem aut placeat nobis. Eius minima sequi velit magnam sunt rerum saepe."
8697595,voluptas,3942,"Dolores voluptatem nam nihil necessitatibus est repellendus. Explicabo dolor doloribus repellendus eius pariatur alias repellat. Dolores dolorem eveniet quos doloremque consequatur unde rerum perferendis. Eos qui qui enim blanditiis cumque laborum."
8711049,quaerat,79735800,"Beatae maxime quo illo qui enim. Ut alias rerum rerum. Et ratione qui non unde ad consequatur qui."
8715837,qui,63698300,"Perspiciatis ipsum ut ipsa labore vel vero est. Ut repellendus ut reiciendis in non velit sit. Praesentium voluptas omnis amet sit id. Est minima quasi ut architecto quas."
8740074,perferendis,4496,"Sequi possimus porro est voluptatem. Ea labore nobis fugiat. Voluptate modi et nam sint laudantium a."
8750695,dolorem,0,"Voluptas voluptate repudiandae et maiores. Sit minus ipsam autem in ab voluptates officia."
8855328,velit,611521000,"Temporibus voluptatem excepturi impedit omnis. Maiores iste voluptatem ab id non. Et voluptatem possimus fuga molestiae totam adipisci dolor."
8937866,voluptatibus,5,"Magnam sed voluptates dolores et expedita libero dicta. Eius sunt dicta molestiae sapiente. Et dolorem animi consectetur excepturi dolor dolores voluptas. Nemo dolor sit omnis aut in facilis iste."
9052113,aliquam,62048,"Cum ipsum cum est libero aspernatur ab. Possimus sunt mollitia eius. A id facilis veniam et et vitae. Debitis dolorem quo provident ut alias."
9064834,deserunt,6262,"Suscipit ut aut molestias aliquid eaque sint. Sint est qui illo dolorem et ut. Quaerat qui ut sequi voluptatum. Sunt autem sapiente architecto eius voluptatibus sit."
9127612,quo,403462000,"Dolor at nihil cumque molestiae doloribus earum omnis. Minus aperiam distinctio natus non nemo et. Sunt velit voluptates assumenda autem. Dignissimos et rerum ea itaque et ut dolor. Ratione corporis magnam odit."
9209295,corporis,46616,"Neque blanditiis hic dolor qui. Ipsa nihil dicta non quibusdam. Est sunt et occaecati voluptatem enim assumenda autem."
9322499,assumenda,77,"Est vitae voluptas blanditiis eum earum et. Modi est aut odio quas qui quia quasi. Aut necessitatibus sit saepe beatae. Et voluptate accusantium labore quos."
9323185,sit,0,"Sint quas esse est tenetur. Suscipit eum reprehenderit et quisquam aut molestiae id facilis. Aut quisquam nulla velit. Dignissimos magni ea omnis qui alias."
9404874,occaecati,88093,"Blanditiis quibusdam laudantium at quia voluptas. In natus dolor perspiciatis. Et et et itaque quisquam sit et numquam. Rem voluptate ut occaecati debitis dolores eaque distinctio."
9409524,dolorum,503,"Perferendis beatae tenetur dolor quasi. Consequatur sed nesciunt quo quidem quas voluptatum. Ut sapiente mollitia quibusdam et voluptas dolore cumque excepturi. Voluptatem repudiandae ut incidunt et expedita praesentium. Illo autem dolores omnis voluptatum corrupti."
9416286,iste,897,"Velit libero sit officiis dolorem. Dolore non non quis quod. A eius nihil iste expedita fuga. Amet nesciunt autem esse a adipisci. Illum repudiandae tenetur architecto."
9462776,tempora,1,"Enim rerum adipisci hic debitis expedita. Non perferendis quibusdam saepe beatae. Molestiae dolorem rerum molestias."
9468462,et,8,"Laudantium officiis culpa molestiae itaque et ipsum voluptatem. Voluptatum neque velit voluptatem repudiandae consequuntur fugiat. Perferendis quos repellat voluptas qui soluta explicabo. Voluptate id id accusantium fuga ut earum soluta veritatis."
9478106,quod,6701,"Qui aliquid excepturi excepturi reiciendis et eum dolor. Sed consectetur nemo quam laboriosam suscipit nam. Corporis corporis rerum in a."
9577641,esse,103173,"Culpa nihil sed molestiae itaque. Possimus saepe laudantium sunt. Ab aliquam esse repellat nisi dicta quisquam eum. Reprehenderit dolor error quos omnis illo a consequatur mollitia."
9656500,itaque,30526000,"Occaecati delectus ut molestias. Pariatur fuga saepe voluptatem non neque exercitationem. Modi vel voluptatem et dignissimos ipsum dolore reiciendis. Quaerat et dolorum amet voluptate nihil vitae. Nisi a id reprehenderit eos alias nisi."
9661431,ab,7652180,"Voluptatem quia ut corrupti animi voluptas sit cupiditate. Nobis optio doloribus deserunt impedit officiis. Sed omnis totam et est et esse explicabo. Laborum omnis debitis eos magnam id qui dolorem ratione."
9698491,adipisci,89688700,"In sunt voluptates dolores recusandae. Provident sapiente qui id. Cumque dolor in dolorem officia ut a ipsam. Omnis non ipsum ipsa fugit labore incidunt et."
9708332,inventore,6662,"Maiores officiis maxime et cupiditate. Ut et repellendus velit voluptate sit perferendis. Omnis maxime earum repudiandae aliquid tempora."
9831357,accusantium,0,"Incidunt repellat ipsum numquam repudiandae ex expedita sit repellat. Qui alias quas accusamus rerum vero. Blanditiis veniam totam sit voluptatem omnis aut et."
9983106,consequatur,6,"Quo corporis at dolor laboriosam. Rerum sunt repudiandae perferendis reiciendis autem. Voluptates assumenda libero et odit cumque. Eveniet nam cumque eveniet et aperiam suscipit."
10784914,occaecati,0,"Nemo ipsum et quae expedita quae totam. Dolores quia quaerat voluptates rerum. Veritatis enim quas quasi non dolores minus. Perferendis non eum a nihil doloremque impedit nihil nostrum."
11233009,veritatis,245497000,"Atque ratione dolor odit est voluptatem. Temporibus unde dolorem placeat beatae architecto at voluptatem. Ipsa blanditiis consequuntur doloribus animi animi ex et."
12509725,beatae,663502000,"Non itaque quia est earum repellendus quis. Voluptatem consequatur tempora alias repudiandae quasi reiciendis dolore. Quidem tempora voluptas amet minus."
13748909,qui,995391,"Explicabo illo sed dolor id placeat. Qui expedita voluptatum quibusdam. Eum aut sit dignissimos molestiae."
14076914,eaque,7203,"Rerum eligendi soluta qui nesciunt et quo. Ab nihil perferendis quia at."
14275217,praesentium,511,"Illum itaque dignissimos dolor architecto est atque. Occaecati rerum sit saepe rem porro nostrum ut similique. Velit eos perferendis magni hic et magni maxime."
14362592,enim,53,"Qui non debitis qui magni aut. Nobis reprehenderit ipsam esse ad tempore dolorum dolor. Similique vitae assumenda consequatur eligendi harum eum enim."
14677392,dolor,15,"Repellendus omnis laborum rem nihil impedit reiciendis deleniti provident. Officia sunt dolor natus."
15594578,laudantium,6,"Voluptates molestias similique sit consequatur at. Dolor eaque neque soluta quia."
15840501,dolorem,2871,"Ducimus porro id aut veniam dolorem voluptate. Perferendis quis rerum rerum voluptatem perferendis. Quo architecto natus nemo esse corporis magnam."
15958236,occaecati,253267,"Iure suscipit suscipit excepturi sint. Quod dolorum cumque magnam. Doloremque laborum excepturi neque voluptatem est libero."
16050587,asperiores,9,"Ad eum quaerat ea cum reiciendis eos. Et aliquam sunt ullam molestias dolorum recusandae. Explicabo qui et dolorum sunt possimus a dolore. Ut nam quia et quo et."
17219895,praesentium,6766,"Officiis quasi placeat labore facilis quo. Quia enim quaerat voluptas distinctio vel vitae labore. Consequatur asperiores consequatur voluptate nemo quia rerum. Soluta eligendi saepe aut."
17266142,et,14695400,"Dolorum est et et explicabo ut recusandae. Voluptatem voluptas nisi aut consequatur dolores magnam illum omnis. Minus sapiente odio quia nisi. In eos ex voluptas laboriosam tempore dicta."
17456943,temporibus,7811,"Et eum iusto esse animi cumque assumenda in. Voluptas harum sint similique dolores. Eos quas atque necessitatibus adipisci."
17493052,labore,9,"Veritatis veritatis est fuga illum. Amet repellendus eius illo cumque. Illo autem tenetur cum aut cupiditate. Est soluta in et et nihil similique."
17539082,ea,74328,"Similique eos nesciunt quis praesentium distinctio ad. Quasi dolores a optio. Dolorem sit eius nesciunt sint ea sapiente et. Aut veritatis voluptate voluptas doloremque deleniti qui. Officia maiores dicta voluptatibus autem sed."
18557623,porro,385,"Cum qui omnis libero ea deleniti. In est repellat molestias qui. Ut voluptatibus in consequatur eos. Reiciendis voluptatibus omnis sit aut velit."
21341896,dolorum,2,"Iusto et sed ducimus similique architecto eum. Neque occaecati ipsa totam impedit sit. Illo repudiandae aut corporis itaque ipsa inventore. Voluptate enim aut ut eligendi. Tenetur alias voluptas et voluptatem quam."
22310525,nulla,468,"Nulla dolorem ea excepturi dolorum nam incidunt libero corrupti. Fugiat velit doloribus illo et qui error asperiores. Non ullam nemo impedit iste ut unde pariatur."
22719112,beatae,786,"Praesentium ut mollitia hic nihil. Laboriosam veritatis perferendis et sint et repudiandae blanditiis. Sed aut sit occaecati aspernatur blanditiis. Fuga incidunt perferendis eos error autem veniam commodi."
23200735,nulla,75749,"Alias nulla nesciunt eos nisi. Nesciunt veritatis ut at sunt dolorum deserunt ipsa. Ut blanditiis dolore porro."
23575624,optio,81139900,"Dolor rerum iure doloremque. Praesentium doloremque libero voluptas delectus. Natus esse rerum cum et et."
24591864,architecto,0,"Quis necessitatibus quae neque soluta natus iste aut. Vitae magni nemo non incidunt laudantium. Rerum eligendi ab veniam et. Placeat quam vel qui."
26574129,est,9,"Sed voluptas sunt nam assumenda. Et optio quis est qui autem non ad. Et eius ad error dolores."
26957669,adipisci,38688,"Odio quo ea nemo modi reprehenderit quas. Deleniti quidem ea aut ratione voluptatem. Quae molestiae omnis non vel suscipit libero dicta. Et eveniet voluptas ea saepe deserunt aspernatur necessitatibus."
28481955,qui,152674,"Pariatur vero aperiam vero tempore et. Quia asperiores ullam cum aut sed ut. Illum quidem placeat non odit. Voluptatem tempora deserunt dolorem et iste placeat voluptatum."
28704477,voluptas,1709,"Totam doloremque aut id. A libero vitae harum harum rem. Ut doloribus nihil architecto autem dignissimos aut excepturi."
29662427,veniam,584286000,"Velit reiciendis omnis est. Dolor porro facilis voluptatem ut rerum. Ex laudantium deserunt accusamus blanditiis necessitatibus."
30646014,sed,53,"Eius molestiae et sit magni cum reprehenderit rem corrupti. Libero necessitatibus accusantium minus laboriosam. Omnis quasi amet neque neque aut omnis sunt."
30670639,possimus,628814000,"Possimus consequatur eius accusantium et ipsum quo nulla. Dolores minima blanditiis aliquid exercitationem et. Accusamus nobis unde nihil vel."
32062109,non,887285000,"Ex iure ea quam quia doloribus voluptatibus veniam omnis. Dicta autem quaerat optio et. In voluptatem aliquid eligendi eaque nulla nostrum quia nam."
32210968,soluta,5,"Sit architecto porro dolore hic omnis illo. Beatae illo et facilis. Exercitationem autem eius aspernatur molestiae qui nostrum. Dignissimos ut qui dolor."
32526261,earum,91,"Velit quaerat est magnam ut praesentium quo fugiat. Praesentium qui quia ducimus. Eum cumque magnam at sequi numquam."
32642229,ut,467436000,"Consequuntur distinctio quia sint molestiae facere repellat. Molestias quam error facere est quo libero ab."
33850900,voluptatem,388,"Nihil non harum recusandae suscipit. Dolores quaerat temporibus sint similique. Dolores porro animi repellat nostrum nobis voluptatum. Minus aspernatur velit expedita illum aliquid doloribus vitae et."
34707067,adipisci,797825000,"Quisquam iure voluptas aperiam iure sunt. Doloremque illum harum ea molestias eum. At sed cumque voluptatem id non et. Iusto illum numquam in accusantium et."
36267137,nam,71,"Molestiae voluptatibus ullam animi officiis nostrum facere. Quia eum consequuntur nam cumque esse perferendis libero. Illo qui animi velit inventore voluptatem ut sunt et. Sit temporibus earum nostrum nisi sapiente odio."
36279780,qui,185068,"Laudantium eius voluptatem ducimus. Vel ut amet dolores ut odio veniam."
37736853,pariatur,191411000,"Iusto molestiae facilis a ipsum. Ut modi placeat quis molestiae tenetur omnis dolores. Optio dolor autem corrupti non laboriosam architecto."
37820588,fugiat,43701400,"Unde similique sint ut reiciendis unde aut mollitia. Repellendus qui fugit nihil laudantium odit eveniet incidunt voluptatem. At explicabo dolores ut. Consequuntur enim ex recusandae officiis aspernatur."
37931586,aut,71,"Aut soluta molestiae expedita expedita. Nobis nihil aperiam sapiente aspernatur qui perferendis. Est id doloremque officiis suscipit animi. Accusamus sunt nulla ullam et sint autem accusamus."
38340031,placeat,0,"Nobis sit ea nulla. Et dolorum veritatis atque ad suscipit. Rerum quis aliquam voluptatibus laborum et facere occaecati."
38526093,sed,9415040,"Ut non repellat doloremque dolores dolores. Et alias autem voluptatem aspernatur enim. Illo ullam voluptate itaque inventore ipsa."
38972772,eum,2,"Ipsa possimus dolores iste. Quidem nesciunt rerum quo officiis. Voluptates ex quia qui earum impedit sequi. Voluptatibus et quisquam a amet et."
39426400,hic,66,"Ut quia id et alias nostrum est. Et ullam natus necessitatibus iure expedita cupiditate. Beatae minus corporis error quia quas sequi et est. Eius nulla pariatur officia voluptas et ducimus."
39676845,quos,77430,"Ut porro qui eos est eligendi eaque. Dicta at eaque et non distinctio iusto facere mollitia. Quia et et qui provident atque ea illo."
39924427,assumenda,403,"Voluptate quae itaque occaecati illo libero delectus. Ipsum quis aut aperiam facere tempora doloremque. Dicta mollitia et quis consectetur delectus."
39938925,rerum,4777160,"Unde voluptatem voluptatem eligendi atque ab. Aspernatur mollitia et pariatur facere laborum. Facere provident ipsum facilis est atque provident et."
40673708,et,75995900,"Perferendis sunt architecto sunt beatae voluptatem illum. Deserunt animi laudantium dolorem et placeat cupiditate magni nemo."
40766662,deleniti,901068,"A repellat dolore cumque nesciunt ipsum. Aut earum quia repellendus sequi inventore omnis. Ipsam officiis possimus voluptate vitae necessitatibus."
41607748,qui,74,"Cumque quas laboriosam minima inventore consequatur velit. Consequatur consequuntur qui nemo dolorem. Porro rerum omnis velit architecto nostrum enim."
41974463,repellat,76010,"Ut unde quis adipisci. Sed provident similique ut vitae illum laborum quod quas. Libero qui qui rerum qui at quos veniam porro. Repudiandae odio ut et expedita voluptatum qui."
42524826,aut,2137,"Facere mollitia repudiandae officiis quia dolor. Consequatur ducimus inventore perspiciatis in reprehenderit porro. Sint aut modi non et et. Voluptates ab corporis doloribus molestiae consectetur ipsam molestias."
43916238,sint,54968200,"Quisquam cumque magnam repellendus. Facere aut molestias incidunt provident odio. Consequatur eum nulla dolor in et alias expedita. Omnis excepturi quidem quaerat soluta consequatur facere rerum. Suscipit minima expedita sed est necessitatibus."
44100337,aut,354560000,"Enim optio rerum molestias magnam. Natus amet molestias eius facilis est. Fugit id sed officia et quia et aliquid. Sed et ullam unde eveniet maiores quaerat asperiores."
44619363,debitis,7673,"Nihil amet aut qui sit ab. Quia ut odit dolor aperiam. Explicabo molestiae accusantium quos consequatur animi. Eius nulla qui veritatis inventore ducimus."
46010990,sit,15,"Impedit saepe nihil vitae culpa. Sequi est molestiae modi facere rerum. Ea et expedita totam et ut aspernatur possimus. Voluptatem officiis velit et ea rerum asperiores perspiciatis."
46563882,repudiandae,1559,"Dolores animi praesentium quisquam qui doloribus perspiciatis quo. Explicabo libero magnam labore similique debitis facere id. Voluptatibus consequatur officia officia."
47500576,quod,52,"Nihil consequatur molestias vitae explicabo temporibus optio. Maiores quisquam autem facilis rerum eveniet ratione sunt."
47775154,ipsam,0,"Ullam accusantium deleniti vel ut. Aliquid ab sit voluptatem rem explicabo cum. Id iste neque expedita non. Numquam nisi eum consectetur dolores ea molestias provident."
48953797,ut,0,"Quasi ut et voluptatem ullam qui voluptas. Labore veritatis aspernatur aut non. Est eius deleniti quibusdam."
50160125,nobis,249,"Ducimus laboriosam amet ut voluptatem nobis qui asperiores. Cumque cum reprehenderit sunt et."
50733755,occaecati,690,"Voluptatem et officiis consequuntur similique. Dolore placeat rem deserunt enim provident. Quasi sint tempora sed ad laboriosam molestias ipsam distinctio."
51362547,aut,693729000,"Consequatur vero soluta est quaerat iste unde ut. Aspernatur voluptatum dolorem nobis nobis quia ut adipisci. Ipsam non fuga dolor dolorem eum repellat. Dolor ab earum sed odit occaecati."
53221493,doloribus,22618300,"Dolores aliquid ipsam reprehenderit eaque aut harum. Et sapiente animi atque saepe in suscipit explicabo."
53818617,voluptatem,4213700,"Voluptatem itaque dolores quia aut minima beatae vel. Temporibus dicta consequatur dolorum doloremque. Sapiente consectetur odit voluptatem sit voluptatem rem. Sint veniam suscipit ut ullam incidunt fugit dolores."
53942317,nostrum,425,"Ullam ipsum debitis quo sed soluta sapiente et. Aut et rerum architecto quia iste eum est aspernatur. Ut tempora dignissimos in nesciunt voluptate laboriosam."
55683091,amet,30,"Molestiae consectetur sed in distinctio tempore excepturi. Est aut animi quaerat. Sed expedita quod voluptatem quibusdam tempora."
55692947,placeat,878,"Omnis similique ducimus est vel vero. Aspernatur deleniti quasi aliquam aut porro. Sequi magni sed omnis possimus. Qui libero quisquam et aut omnis voluptatem. Eos dignissimos nisi tempore quaerat."
56540466,officia,90,"Nihil at qui adipisci aperiam eveniet. Vero minus magni nulla atque et quis. Non perspiciatis non omnis laborum ullam ipsa qui suscipit."
56542648,ea,7911030,"Maxime earum voluptas eos et. Vitae et nulla tempore consectetur cumque saepe tempora. Sint reiciendis quidem fugiat. Cum error ut sequi explicabo."
57049722,facilis,80,"Mollitia qui architecto rem nisi vel quis in. Eos quia ea consequatur. Esse exercitationem aut delectus aperiam nesciunt. Fugiat sit debitis sed fuga optio voluptatem qui."
57272911,possimus,7388030,"Omnis dolore architecto accusamus labore. Enim rerum soluta sed error et non. Perspiciatis aut voluptatem aliquam a maiores. Qui quo sed omnis quia placeat quam tempora."
57463096,nostrum,94,"Beatae quibusdam qui voluptas dolore ducimus aut ab. Dolorem culpa ipsum enim. Itaque voluptatem animi natus sit."
58057667,pariatur,49636900,"Deleniti aperiam a illo sit sed ullam. Consequatur repellendus beatae est iste. Voluptatem esse commodi in qui eius numquam. Dolorum occaecati earum numquam officia aut quasi dolores."
58789175,autem,3,"Iusto rem deserunt voluptas iure enim velit voluptate. Sunt nam eaque voluptate laborum et. Hic deserunt quis a vero. Dolor occaecati architecto qui libero eum aspernatur laudantium excepturi. Minima ullam exercitationem velit provident cum."
59020465,aut,116123000,"Est vitae illo quia. Ducimus amet ducimus nostrum est fugit et."
59309369,vitae,3924500,"Enim odio qui dolores aut cumque illo. Consequuntur ipsum aspernatur quis eius tenetur et ut. Fuga consectetur ipsam eos et."
59959309,dolor,8563,"Iure libero non doloribus. Soluta repellat nesciunt qui corporis. Optio enim molestias ipsa cumque earum sed."
60543383,sunt,39949,"Ea vitae natus perferendis facilis amet facilis voluptas nostrum. Deserunt quibusdam officia explicabo repudiandae sint. Facere ipsam dicta quis est facilis architecto."
61402959,rerum,0,"Culpa totam deleniti recusandae recusandae possimus. Voluptatibus dolore in sed asperiores deleniti ut fuga. Accusamus velit occaecati suscipit ipsa dolores ut."
61722344,beatae,9653,"Dolorum corrupti iusto deserunt excepturi. Sed numquam quidem quia reiciendis. Non in ullam a maxime. Aut dicta quis molestiae repellat."
61969675,dolorem,23,"Quibusdam molestiae suscipit sint et. Modi aspernatur molestias atque quae et labore. Ullam voluptatem quidem occaecati."
62917828,est,8912,"Rerum vitae fugit autem voluptas sed est rerum sint. Minima pariatur voluptatibus qui quo. Ullam ipsum consequatur voluptas sed."
63002846,ducimus,29055,"Nihil unde qui hic. Officiis itaque voluptatibus voluptatem natus necessitatibus eveniet ab. Quis distinctio natus et incidunt harum pariatur nihil. Perferendis dicta neque rerum sed."
63792343,rerum,35870000,"Quam et quis velit aut possimus nemo veniam. Provident dolor doloremque recusandae quam cum. Molestias dolores illo quas. Officia fugit et reprehenderit eius."
64560383,voluptatibus,248,"Magni deserunt dolorum rerum cumque fugit. Omnis perferendis sed et expedita facilis. Sit magni cupiditate non nihil. Quidem est enim illum incidunt rerum. Aspernatur ad illum ea sed eum sit reprehenderit et."
67719571,excepturi,807,"Ut debitis eos illum magni ut rem qui. Pariatur quae necessitatibus minima expedita quod. Aut eos id rem reprehenderit commodi provident suscipit."
69952376,aut,3478130,"Eius cumque odit voluptatum non exercitationem enim eum. Consequuntur quis quia exercitationem quis et consequuntur. Iure expedita esse sequi nam."
71154136,sit,2,"Atque error consectetur numquam iste. Earum aut consequatur recusandae. Enim eius consectetur dolor facilis ut et nemo. Eveniet quisquam optio iste consequatur."
72235506,officia,416,"Fugit laboriosam id ut eos accusamus et aliquam officia. Aliquid fugit maiores sit ea voluptas totam cum nihil. Quis et et explicabo dolorem ab impedit. Fuga dolores qui laudantium facere numquam autem."
74095450,rem,270265000,"Cupiditate similique vel perferendis magnam est dolor. Aliquid ipsam illum cupiditate possimus asperiores est. Ullam dolor quo voluptatem quis qui. Repellendus harum molestiae earum qui omnis et."
75540428,sed,87189,"Iusto ut voluptas hic est totam autem dolor. Iusto rerum libero vel. Laboriosam repellat impedit dolores et."
76264534,nisi,7,"Porro sint fuga neque rerum commodi dolore. Ea alias vel ea aut. Doloribus aliquam corrupti voluptas maxime."
76675825,eaque,714103,"Quos veniam vel sed rem. Est ratione earum facere beatae unde quia corporis eos. Accusantium id et similique quisquam occaecati ut voluptatem. Alias iure aperiam distinctio voluptates impedit ut."
76692500,expedita,2,"Aliquid est animi culpa neque sequi quidem. Quia vel beatae a voluptatibus ducimus inventore maxime. Consectetur libero inventore voluptatibus cum."
77241004,ea,886,"Qui qui repellendus occaecati eius id atque sequi. Earum atque quia in est et est aut. Quisquam qui tempore natus animi soluta consequatur. Numquam quia et occaecati nesciunt ut quia. Molestiae aut velit doloremque repellendus."
77872654,ea,0,"Vel nemo nihil placeat. Amet deserunt non voluptatem eligendi et. Et voluptatum nulla asperiores debitis odit."
78267486,qui,54,"Omnis quae voluptatibus ad eius sit ullam aut expedita. Perferendis sequi dicta quam repellat delectus. Sit nostrum voluptatem aut maiores numquam aliquid. Recusandae pariatur ut dolores quam voluptas atque."
79908439,odit,367183000,"Adipisci corporis officia et et rerum sunt ducimus corrupti. Animi harum voluptate inventore culpa quis. Aspernatur voluptatem itaque cum quam."
