recipeID,recipeName,calorie,recipeDescription
911886,vitae,41917,"Voluptatem eum eaque placeat sed explicabo. At maiores nobis explicabo ut. Sed illo repellendus accusamus earum placeat rerum et. Veniam magni quam a."
912507,cupiditate,28180600,"Quia quis aut ut amet voluptatibus. Eos excepturi tempore blanditiis voluptas. Labore ut repudiandae recusandae repudiandae. Quia et libero rerum aut animi."
913008,ut,380243,"Est voluptatem qui maiores quidem consequatur velit perspiciatis. Eum ut alias dolorum sed voluptas. Est est atque illum. Error error quibusdam totam esse."
918220,molestias,21,"Deleniti qui velit dolorem officia et nulla. Odit dignissimos illo molestiae adipisci ipsa et aut recusandae. Facere nobis numquam minus ipsum id et et sunt. Nisi ea in provident necessitatibus fugit sunt atque eveniet."
920527,minus,7,"Mollitia quae maiores rerum vitae qui. Officia debitis explicabo praesentium ut sed voluptas delectus. Ducimus porro voluptatum et ipsum et porro adipisci eligendi. Laboriosam eius doloremque laudantium beatae et. Quidem harum quia omnis laudantium deleniti quae ipsum."
922182,repellat,7071,"Dolor dolorem qui iure pariatur. Molestiae eaque qui eligendi similique beatae sunt. Voluptatem a quidem recusandae quae tenetur ipsum placeat."
925361,quo,34,"Dolor voluptatem totam voluptate corrupti ut accusantium. Necessitatibus vitae ut modi facere voluptatum."
927719,suscipit,197449000,"Est soluta ut adipisci illum voluptatem autem non eos. Assumenda ducimus ullam voluptas aut et. Sit voluptate sit at sint adipisci. Dolore ducimus quo consectetur esse veritatis vero voluptatem sunt."
934099,dolor,467,"Consequuntur voluptatem nemo dolore omnis cum. Ut eum eos quia non ad quaerat. Libero ut facilis ipsa ab et neque. Porro praesentium aut reiciendis aperiam."
936556,voluptatum,4152950,"Sit deserunt et est earum quia ipsum. At reprehenderit ea consequatur mollitia rerum sed non. Rem ducimus rerum minus nam. Consequatur neque et eaque fuga et exercitationem."
937201,eius,44801,"Aut vitae et repellendus aspernatur velit. Nostrum ea cupiditate aut hic minus ad et. Fugiat esse ut pariatur dolorum expedita expedita."
941081,voluptatem,9794,"Perspiciatis nemo est dolorem enim. Qui voluptatem enim omnis aut repellat. Quam corporis vel delectus in et modi itaque facere."
949943,aspernatur,21423,"Ex dicta sed modi officiis. Amet doloribus quis labore voluptas voluptate eum officiis. Eos dignissimos modi ut repellat eos."
964990,amet,84,"Doloremque atque placeat est omnis voluptas et cum. Aliquid doloremque et ab sit et. Id eum officiis quia magnam. Doloribus cumque eligendi sed qui non. Qui fugiat delectus reiciendis eveniet repudiandae dolores."
979003,voluptatem,99448600,"Nihil sint iusto aspernatur animi minus. Voluptate ad aut enim voluptatem consequatur minus. Quae qui dolorum iusto quis quod explicabo hic. Optio aperiam accusamus consequatur placeat ullam molestias et. Dolores eos et autem rem enim laboriosam."
982305,repellendus,82,"Dolor ab ut ut maxime voluptate soluta. Dolorum excepturi eveniet necessitatibus. Officiis sed perferendis facere debitis id qui. Similique nihil consequatur expedita doloribus et mollitia."
984332,ut,36,"Veritatis voluptatibus qui voluptatem asperiores ducimus deleniti. Qui pariatur nesciunt ab consequuntur harum nobis ducimus. Et reiciendis ipsam rerum voluptatem."
984341,recusandae,247,"Consequatur est nihil illo ut consequatur. Perspiciatis aspernatur voluptas saepe officia rerum blanditiis optio. Eum ex iste repellendus sunt ex optio blanditiis."
993648,molestiae,66,"Harum omnis officia nostrum itaque minima corrupti occaecati. Aut nulla aspernatur exercitationem magni occaecati officia quae. Optio perspiciatis qui blanditiis et perspiciatis iste. Voluptatem id consequuntur impedit iure quo reprehenderit."
995033,nobis,33691,"Aut quaerat eligendi qui nesciunt quasi accusantium cupiditate. Labore eligendi eveniet aliquid corporis laborum. Beatae rem unde rem ut aut dolor velit et. In voluptatibus nemo voluptates magni mollitia."
999567,occaecati,0,"Id voluptate eligendi sint ipsum. Quos voluptas repellat facere debitis sit accusamus. Est est sunt vero sunt et autem."
1026213,suscipit,0,"Ut explicabo dolorem nihil ipsa occaecati quos animi. Nesciunt quo quidem sit rem. Molestias voluptates aut perferendis perspiciatis."
1042506,sed,147,"Voluptas quam pariatur tenetur et optio atque molestiae. Officia et unde quidem velit quia nostrum quidem."
1042917,reprehenderit,11365300,"Omnis occaecati et ut debitis. Natus eos quam sapiente ab. Dicta maxime nihil dignissimos tempore veniam iste at."
1250845,et,37753000,"Ut amet non dolores provident et aut est. Ut beatae molestias voluptate aspernatur itaque rerum aut. Eligendi voluptatum dolor et voluptatem."
1398600,quia,0,"Esse enim et nihil perspiciatis ut ipsa expedita. Incidunt illum in ut est. Nostrum quia ea maxime earum."
1414688,earum,535503000,"Voluptas molestiae voluptatem ipsa possimus voluptatem. Ipsa sequi sint quia quis doloremque at optio. Voluptas sapiente fuga voluptas unde. Aut vel cumque doloribus et nihil."
1450841,odit,5,"Consectetur voluptatem ut aut quia ab amet sint libero. Et autem et et possimus expedita quae dignissimos. Eum eum doloremque distinctio fugit nam."
1474521,dolorem,509408000,"Neque est neque ut molestias dolores. Occaecati minus ut qui harum distinctio magni non. Mollitia sunt voluptate ipsa et minus voluptas eligendi. Molestiae molestiae doloribus cum voluptatum dolorum voluptas."
1570329,et,135335000,"Aperiam impedit id consequatur assumenda. Illum aut saepe provident. Occaecati aliquam aut neque non vitae ab quisquam. Consectetur laudantium delectus qui alias reiciendis rerum consequatur doloremque."
1666778,voluptatem,4513,"Mollitia eveniet aut et voluptas ipsum qui. Nihil iusto nihil quidem. Sed molestiae pariatur amet nihil alias qui maxime. Expedita vero pariatur modi culpa vitae similique aspernatur sunt."
1680189,ducimus,0,"Exercitationem adipisci tenetur voluptatibus adipisci vero tempora consectetur. Labore minus praesentium quaerat veritatis temporibus quia dignissimos. Itaque voluptatem tempora ut ut est sit."
1720364,voluptas,6942330,"Id quia laborum quisquam et. Molestiae similique earum quaerat ut hic nostrum asperiores provident. Non eos nam ab. Nulla laborum sunt ut."
1727551,magni,59424900,"Repellat vel eaque beatae vitae sit est. Ratione debitis qui consequatur."
1786482,fugit,66670300,"Voluptatem placeat dolores impedit ut dolorum. Illum pariatur et non non et qui nam cumque. Omnis et tenetur facere dolor aut vel. Aut saepe et recusandae officia in id."
1834255,soluta,58140100,"Facere praesentium provident reprehenderit odit possimus. Impedit quis voluptatum ab amet dolorem aliquid cumque. Voluptatem nostrum qui porro consectetur pariatur. Quasi animi incidunt ipsam iure magni est possimus."
1871696,odit,24102500,"Earum est illo aut. Et fugiat omnis quam recusandae. Sit est omnis qui voluptates qui. Eaque deleniti tempora nulla quaerat perferendis laborum."
1957484,voluptate,54838900,"Est libero nemo ut nemo autem numquam. Odio sunt non mollitia quaerat ut aut voluptatem. Id id soluta sint sed aut consequatur."
2001846,aliquam,46,"Voluptas maxime ducimus quae est unde omnis. Sunt vero blanditiis vero non laboriosam libero et. Voluptatibus unde natus fugiat et dolor pariatur in. Nesciunt consequuntur ut et soluta officiis praesentium."
2025668,nam,7471,"Voluptatem et laudantium molestias enim ut. Nobis nisi iusto incidunt et commodi quidem optio. Dolor soluta neque cum qui id omnis possimus voluptas. Asperiores sed dignissimos et ipsum."
2034220,voluptatem,0,"Eveniet doloribus suscipit dolore id laboriosam excepturi. Consequatur dolorum modi modi. Quisquam molestiae in beatae aliquid dolorem."
2039921,ea,1596,"Et voluptas sed alias consequatur. Eius aliquid in culpa aut. Ab mollitia quam voluptatum tenetur consequuntur et."
2087900,ipsum,151338,"Ab rerum quam delectus at facilis doloribus. Voluptate itaque et eligendi consequuntur ut temporibus. Voluptates qui alias enim ut placeat voluptatem in. Veritatis quod delectus temporibus autem."
2103267,eius,66193700,"Quis in et et tenetur a tempora totam. Ut illo eveniet eligendi id. Sunt sint libero dolor neque ut. Debitis voluptatem occaecati voluptates facere placeat."
2163027,suscipit,4,"Sit sit non iusto nisi labore qui. Aliquid repudiandae sint qui animi ab repellat vel recusandae. Autem veritatis nobis iure qui. Minus qui ratione ducimus nesciunt."
2380153,nam,0,"Earum suscipit minima optio ratione commodi itaque. Alias voluptatem fugit quo at nam debitis voluptatem."
2402985,perferendis,0,"Facilis officiis in sit et quisquam sit. Fuga eos fugiat enim nesciunt. Suscipit autem eius quia debitis eaque nobis nam perferendis. Qui vel cum quia eius."
2502826,fugit,1360,"Similique aliquid amet voluptas dolores ut ut deleniti sed. Nisi a harum nesciunt beatae dolorem ex. Et et quam at ut hic suscipit. Qui dolore et aut modi voluptatem omnis nobis."
2743600,beatae,70,"Velit iusto ut labore ab est beatae asperiores. Accusantium cupiditate quos autem eligendi magnam iste ipsa ut. Eaque id qui sit exercitationem sed est inventore."
2764473,corrupti,0,"Molestias sit vel exercitationem vel voluptatem natus. Culpa et voluptatem et sed assumenda alias accusantium. Et neque aliquam culpa officiis sed."
2815012,tempora,9280780,"Non qui voluptatem ab at fuga omnis. Illum ratione suscipit dolores dolore placeat sequi et. Voluptas voluptatem quaerat sunt dolorem voluptatum et."
2851575,dolorem,100757000,"Dignissimos qui aut laudantium sit. Accusamus perferendis dolor itaque eaque. Neque qui suscipit libero ducimus rerum quibusdam et aliquid."
2859679,molestiae,1923,"Voluptatibus dignissimos soluta quis cum commodi minus eum. Consequatur officiis a et voluptate deserunt corporis qui. Facere qui architecto tempora illum dolorem amet."
2875442,ut,25290000,"Natus id et omnis ut aut. Quia id non vitae sit eum. Quibusdam laudantium unde eligendi reprehenderit voluptas. Et cupiditate aut consequatur aspernatur nesciunt dolor molestias."
3152926,ipsa,53308,"Et quia qui suscipit non voluptas et. Libero eos nihil iste architecto nemo. Hic voluptas consectetur accusantium vel. Placeat debitis quia impedit suscipit. Consequatur esse sit qui deleniti alias quo nobis."
3219392,nostrum,80631,"Debitis omnis alias aspernatur animi laboriosam. Dolorem illum itaque non sit corporis. Veritatis dolorem vero sint non pariatur itaque. Optio fugit ut porro velit nostrum officia voluptas."
3227020,sit,854332,"Est velit neque expedita et voluptas. Corrupti fugit error nemo nihil ex repudiandae quaerat optio. Et eos minima quas fugit recusandae minima ut."
3268915,corrupti,0,"Tempora distinctio numquam culpa possimus nostrum perferendis. In qui aut neque porro quis perferendis. Illo iste aut voluptate officia facilis dolores dolorem sed. Nostrum quaerat non sapiente nesciunt."
3279311,dolor,311697000,"Iste impedit omnis commodi et voluptas. Esse repellat soluta similique voluptatem. Totam et eaque dolor ipsum enim natus ex temporibus. Ut quam repellat vero ea."
3284656,dolorum,93925,"Illum omnis officia eum quos officiis dolor quod. Quae suscipit temporibus dolorem possimus non quidem. Pariatur recusandae dolores aperiam facere. Eum quo sint ea sapiente eveniet."
3320843,nam,69324500,"Exercitationem eveniet doloribus sint a magni animi sed. Neque voluptatem sint maiores fugit commodi architecto aut tenetur. Consequatur porro quo fugiat sapiente dolores. Atque voluptatem possimus sint voluptas odio est exercitationem."
3381835,quidem,134,"Sit consequuntur animi sed ex qui quisquam tenetur. Eum ex mollitia autem qui reiciendis. Sint similique sunt explicabo aspernatur enim. Provident illum voluptatem consequuntur qui suscipit."
3406336,et,739715000,"Eligendi non at dolores maxime reiciendis corporis. Non dolores iste ut sunt ratione sunt. Voluptatem voluptatum dignissimos sunt quasi non. Incidunt et laborum qui beatae ipsum eum placeat maiores."
3535715,repellendus,15718100,"Ea ratione reiciendis quia unde aperiam sequi saepe. Voluptate aut corporis iure nam dolorum quo. Sint consequuntur impedit veritatis perferendis ipsam. Et eos maxime qui et quia. Nesciunt qui officiis autem corporis."
3553528,in,2593570,"Nemo et mollitia sit tempore sit iure ea. Repellendus culpa quia cupiditate fuga suscipit illo sint. Eos maiores ex nulla maiores aut nobis."
3648303,nemo,5057,"Ut quis sapiente aperiam et voluptatem cupiditate alias. Dolore quia nulla necessitatibus adipisci sit. Architecto aut praesentium totam ad voluptatem."
3663252,minus,543,"Sint magni sunt facilis ut minima ipsum. Eaque sit amet non vero perspiciatis. Necessitatibus voluptates eum quo placeat rerum dolorem."
3676473,deleniti,391184,"Ea quae expedita saepe. Dolore placeat natus iusto accusamus consectetur impedit accusantium ea. Voluptas aliquam nesciunt nostrum et delectus quia qui."
3731979,ullam,98,"Autem itaque eligendi fugiat at. Dolorum odit quia omnis earum. Dolorum inventore animi id voluptatibus adipisci. Commodi et consequuntur sed itaque quod ea occaecati."
3785123,et,8129,"Sed libero quis harum sequi. Ut quod fugiat est officiis quidem facilis fuga. Nemo suscipit voluptates temporibus atque. Fuga vel pariatur quas sunt qui aut tenetur."
3809915,sit,253311,"Fuga odit nisi consequatur ut. Molestias enim est minus quos ad. Sequi et quae architecto soluta ut laudantium."
4166494,totam,25654,"Alias excepturi odit ad exercitationem nemo. Ad aliquam nobis quis ut."
4186002,fugit,69717,"Sed autem nihil vero ut. Exercitationem eius explicabo aspernatur."
4195489,eos,4261,"Voluptas non quia dolor quo dolores reiciendis voluptatem. Adipisci et mollitia unde qui non."
4241070,et,175,"Est quidem accusantium aut occaecati. Blanditiis sunt excepturi voluptatibus aut. Culpa placeat illo eos sed."
4241715,rerum,190386000,"Fugit non molestiae corrupti sed facilis. Reprehenderit repudiandae ut facilis cum nulla repellat. Id nihil sed veniam porro."
4628046,quibusdam,6,"Quia sed voluptatem autem qui. Voluptas ut dicta eveniet voluptatem mollitia dolorem quasi. Maiores iste ea quia nemo omnis vitae rerum. Consequuntur maiores architecto aut voluptatem officiis itaque."
4677290,corrupti,404,"Repellendus ea dolores quaerat non quae. Necessitatibus porro enim possimus iusto est enim quo est. Nam possimus et exercitationem aut aperiam. Voluptatum molestiae explicabo quae porro."
4701175,quaerat,61716300,"Molestiae ut eos ea magnam. Reiciendis et est maxime laboriosam voluptate repudiandae qui. In aut quos occaecati doloribus."
4790618,incidunt,6192,"Quasi laborum qui dolorem reprehenderit optio ab eligendi id. Explicabo debitis quam natus voluptatibus qui. Aut velit consequatur nihil aut et."
4798833,qui,24,"Vel nihil non minima quia quos voluptatem et. Aut quasi earum in et libero explicabo ea. Accusamus ut cum consequatur similique ut eos aut. Placeat quidem non corrupti maxime sed impedit aut."
4824039,in,515,"Aliquid ad excepturi voluptatum sed. Natus omnis rerum ad totam. Omnis quam reprehenderit fuga quas. Voluptatem inventore quod necessitatibus itaque."
4884078,aut,6142710,"Quo sit et similique qui aperiam blanditiis quasi enim. Consequatur ipsam suscipit tempore sunt est quos earum. At quo quidem voluptates voluptatem officia. Quis sit adipisci sint exercitationem."
4893319,eius,763988,"Id quis nam nihil cumque assumenda ea ullam excepturi. Ut aspernatur quo maiores sequi et. Enim qui autem corrupti. Libero a facere autem eveniet magnam."
5109028,eveniet,0,"Excepturi illum ut sit quis perferendis et ut. Consequatur id maiores rerum fugiat. Mollitia nobis voluptatibus modi non. Totam ex non rem placeat."
5140806,modi,1,"Autem molestias eius iste ea adipisci ea voluptatibus. Rerum consectetur dolores hic consequatur aspernatur dolorum esse sed. Consequatur quia enim dolores minus nesciunt sed. Ipsam repellendus dolores incidunt laudantium reprehenderit."
5159603,et,24471400,"Et nulla qui voluptas nisi libero dignissimos. Autem quo dolorem omnis nam. Quia ab ad dolores ipsam. Aspernatur ut aut et adipisci rem quae corrupti doloribus."
5198887,labore,3,"Eos porro eligendi quas alias fugiat. Nisi possimus consequuntur ut eaque. Et consequatur sit odio tempora cupiditate aliquid laudantium. Ut quas natus ut nesciunt libero. Iure inventore et et non."
5199979,sed,106289,"In odit amet cumque quisquam nulla. Nihil sit ut illum quae provident est. Aut nihil dolores ut praesentium cumque architecto. Quia excepturi sapiente non doloribus doloribus."
5294383,sit,12,"Quas beatae dolorem dicta incidunt sit. Beatae corporis impedit dolor aut amet maxime. Assumenda quia nihil eaque nobis ut placeat in."
5296400,eum,6882,"Assumenda laudantium dicta eveniet. Aut et ipsum eos voluptatum. Vero veritatis sunt adipisci modi hic. Expedita ea et in non doloremque."
5415304,aliquam,2816950,"Et dolor incidunt odio veniam blanditiis quidem. Ipsum porro et cupiditate natus. Eligendi itaque voluptatibus eum doloribus. Accusantium autem enim ipsa qui distinctio saepe."
5421892,perspiciatis,0,"Aliquid excepturi necessitatibus ut. Qui ad eaque ut modi corrupti fugiat sapiente. Sed nihil voluptas et asperiores quia velit. Nostrum quidem commodi qui exercitationem rerum ut suscipit."
5494711,ut,5,"Et sed velit in iusto sit voluptate. In impedit eaque quibusdam impedit dolorum recusandae. Rem tempore sit et rem dolores occaecati optio. Similique exercitationem nihil ut praesentium."
5536694,omnis,31,"Rem rem non nihil exercitationem quisquam quibusdam at. Consequuntur consectetur reprehenderit et iste laudantium aut pariatur. Nostrum repellat quo vitae placeat aperiam sint iusto aliquam. Perspiciatis quia culpa ipsam excepturi atque."
5546209,in,0,"Et voluptatem soluta voluptatibus laborum ipsa qui voluptatem. Hic et autem incidunt ut et. Sint sequi quia qui nisi laboriosam debitis ipsam."
5553647,tenetur,2527,"Odio ratione dicta exercitationem repellat. Sunt earum eum alias optio quibusdam temporibus. Neque qui totam ipsam doloribus illo facilis placeat repudiandae. Aut quia earum assumenda at molestias."
5577926,natus,1,"Non explicabo sed a quod consectetur enim. Consequatur sit et quo vero unde laudantium possimus. Aliquid soluta necessitatibus velit vitae minus voluptas."
5580417,explicabo,3263,"Est voluptatem doloremque sit dolorum deleniti repellat. Sequi repellat optio incidunt fugiat quia ut. Illo exercitationem nostrum voluptatem voluptatibus. Maiores neque tenetur voluptas cum ut non cupiditate."
5586772,deserunt,4739,"Facilis qui omnis minima nam repellat dolorem. Voluptatem et non consequatur dolor dolorem. Voluptatem assumenda non repudiandae ex id quia. Quia similique facilis et quis animi."
5621959,recusandae,53,"Aut aliquam cum expedita quibusdam. Rerum labore cum voluptatem eum cum in nihil."
5670094,libero,0,"Dolorum id accusamus praesentium quasi odio et. Sapiente voluptatum voluptatem est aut. Quos quo hic atque quia id rerum quo."
5671283,ipsam,408997000,"Omnis sunt aut aut expedita nam. Quam consequatur facilis fuga sit ut aut. Fuga corporis consectetur laboriosam harum porro inventore velit. Dicta necessitatibus facilis saepe enim."
5691495,velit,3330,"Voluptatem rerum nesciunt earum sit a sit libero ut. Ut vero debitis id ut. Enim adipisci sed et dolor debitis. Exercitationem quae blanditiis laborum laudantium eveniet vel sit. Ut dolorum deserunt voluptas perspiciatis minima magni est."
5908851,minima,0,"Reprehenderit amet provident velit quia consequatur eaque. Iusto nulla necessitatibus et laboriosam dolores ullam. Tenetur et molestiae natus voluptatem ab unde consequatur distinctio. Officia voluptas quia aut ullam quod et."
5924175,ex,886418,"Corporis eveniet debitis rerum corporis. Dolore cupiditate est assumenda eaque alias. Distinctio ipsam quam porro ducimus ut."
5950229,incidunt,8814940,"Iste repellendus omnis quis. Magnam velit sequi modi voluptatum. Atque corporis tempore non dolores doloremque quidem."
6055189,ea,880450,"Sunt ex aspernatur fugiat facere quibusdam. Voluptatem quaerat nobis possimus quia sed. Quia dolor tenetur consequuntur."
6086171,in,503,"Et deserunt libero autem ut. Aut perferendis qui eveniet consequatur ipsa. Pariatur minima sed occaecati voluptatum voluptas nihil consequatur."
6123120,veniam,31401,"Aut doloremque deleniti harum quia temporibus ad repellendus. Quo eum nobis eaque nihil eaque. Et sit necessitatibus ullam."
6279591,nam,0,"Aut ad aut ratione consequatur. Distinctio temporibus quis accusantium consequuntur at. Accusantium sit sit vel."
6358951,et,3463610,"Voluptas aspernatur temporibus sunt incidunt natus quasi. Ea enim velit est. Molestiae optio cumque magnam repellendus et. Inventore quasi vel reiciendis aut tempore."
6379860,ut,298,"Alias debitis aspernatur natus laboriosam veniam repudiandae sed. Sint sequi quibusdam sit consequuntur et eligendi non alias. Et fugiat qui omnis perspiciatis facilis amet dolores. Quis praesentium quisquam et id suscipit."
6405940,voluptates,3142640,"Doloribus magni et distinctio quos et omnis. Nesciunt nihil dolores sequi voluptas recusandae. Quaerat eius nihil nobis et. Aliquam omnis voluptate nihil quis."
6415871,nihil,450353000,"Eius et commodi at tempora quod enim esse. Facilis consequatur delectus excepturi illum laboriosam et. Non numquam vitae ea voluptates placeat. Quod beatae maiores quos odio voluptas."
6427969,est,5348930,"Velit rerum et vero id velit voluptas culpa. Odit labore facere dolor quis dolores tempore laudantium. Exercitationem velit voluptatem fuga nihil maiores temporibus quis."
6496528,aut,61060100,"Veritatis esse et magnam. Temporibus itaque maxime sit labore molestiae adipisci quidem nisi. Alias ullam laboriosam suscipit repellendus et quam velit. Tempore qui id dolorum saepe qui cupiditate est."
6521571,ut,972,"Illo quod praesentium rerum est. Nostrum deleniti sed omnis ut eos ut voluptas ullam. Non rerum repellendus ut ut maxime quia est sint."
6577343,et,3,"Dolores mollitia saepe explicabo et. Ut molestiae error id veritatis incidunt alias. Ut amet autem architecto explicabo modi iure. Et amet quo iusto voluptate enim blanditiis architecto enim. Molestiae voluptatum eligendi et molestias harum."
6688171,adipisci,212794,"Distinctio ipsum ut et voluptas atque a quaerat. Quisquam est nulla ducimus molestiae. Provident pariatur qui temporibus vero modi perspiciatis. Quo at ipsa nemo ipsam."
6725031,quas,8333520,"Non voluptatem numquam totam vero. Sed placeat temporibus voluptas voluptatem mollitia. Commodi impedit aut consectetur voluptatem."
6727128,qui,9807150,"Recusandae est non est enim id necessitatibus deserunt. Esse deserunt ea atque odit maiores sequi. Sequi et repellat vitae."
6743928,sint,1690,"Et quo dolore quia iste perferendis qui. Id quas inventore incidunt beatae consequatur est reiciendis. Quia asperiores asperiores recusandae distinctio eius qui non. In sit est qui facilis velit non qui. Rem et et facere eaque sint omnis."
6757661,molestias,7536050,"Aut omnis aut quia. Architecto optio sit aliquid ut et. Voluptate reiciendis similique nesciunt laborum. Quas quam voluptatem fuga similique aut modi molestiae ab. Qui et qui nisi delectus deleniti amet ducimus."
6899738,voluptatibus,896802,"Temporibus et ea debitis minima ut temporibus quia necessitatibus. Debitis architecto dignissimos et. Et et voluptatem explicabo voluptas molestiae rem debitis. Ut laboriosam quisquam odit voluptates quibusdam optio maxime."
6908846,quia,22585,"Non dignissimos omnis ab qui et. Illum et aut quis ullam. Rem deleniti consequatur nihil id quod."
6954276,quibusdam,226,"Voluptatem explicabo explicabo placeat cupiditate atque architecto tenetur dolorem. Quis illo laudantium esse modi quae. Eum ipsam blanditiis et."
6959056,aperiam,75876200,"Ullam perspiciatis sunt officiis voluptatem sequi eaque incidunt. Quia labore quos quod veritatis quas. Et ut soluta possimus esse."
6996476,et,9642950,"Eos laboriosam minus neque harum magni. Neque numquam amet doloremque laboriosam. Est assumenda ea cupiditate hic. Voluptatem et repellat ea ut temporibus at."
7078810,molestiae,9,"Dolorum sint odit aperiam et provident rem qui. Sed possimus reiciendis et rem. Aut tempore et quam."
7309370,est,109,"Mollitia quis quo qui. Expedita nostrum provident voluptas nemo molestiae vero. Minus alias eius rem fugiat. Quaerat provident beatae expedita odit aut quia ratione. Accusantium temporibus fugiat laudantium."
7322135,sed,1101,"Sit a voluptatem quod ipsa earum dolore a. Dolorem ut repellendus quaerat nulla. Quae sed sint provident exercitationem et voluptate est."
7385041,et,1,"Voluptates vero possimus repudiandae. Odit quos hic optio quia dolore quidem quisquam eaque. Autem nobis non dolorem. Sed fugit accusantium deleniti temporibus dolores."
7392376,aspernatur,644233000,"Saepe sunt sunt mollitia voluptatem quis dolorem et nisi. Sed iste maiores in omnis nam dignissimos nihil. Autem unde dolores sunt saepe rerum voluptas. Quia repellendus sunt ut atque eveniet distinctio."
7565619,sapiente,861,"Numquam voluptatem quis voluptatem aut. Et sint quibusdam aut facere ea. Et molestiae laboriosam ipsum ut fuga. Sapiente et in dolore. Consectetur molestias ipsum amet adipisci qui cupiditate."
7707334,voluptatem,0,"Qui qui aspernatur provident quibusdam. Perspiciatis nostrum consectetur dolorem nihil vel quae. Eos fugiat veniam et voluptas numquam aut dolor cumque."
7763888,quidem,44,"Sit iusto labore quod sint sit suscipit cupiditate consectetur. Eligendi doloremque a nostrum magni ut labore tempora impedit. Consequatur iure autem aperiam et harum. Ratione unde eaque provident."
7855145,et,46529000,"Repellendus quisquam repudiandae itaque ipsa et. Fugit provident est saepe quo ut. Recusandae esse doloremque quod doloremque ut. Ut eum iure sapiente et quidem officia."
7877676,magni,8,"Ducimus adipisci dolorem tempore necessitatibus possimus velit est. Odio eos officia molestiae sit."
