recipeID,recipeName,calorie,recipeDescription
1,iste,66635000,"Unde fugiat aut modi totam. Sequi omnis doloribus facilis ut et sed explicabo. Modi eaque at minima minus sit. Qui soluta sit illum voluptatem. Voluptatibus dolor quisquam dolorum laborum impedit."
2,labore,5737,"Vel modi labore quibusdam exercitationem repellat quae. Cum debitis deserunt tenetur distinctio in fugiat. Quo corporis officia ut et aut."
3,sit,39872,"Pariatur sunt sit ut ut consequatur optio nihil. Consequatur tenetur architecto omnis error magnam debitis. Magni aperiam et officia alias repellat consectetur. Exercitationem aut accusantium omnis voluptatum fugiat asperiores."
4,quia,63291,"Officia aut qui deserunt laudantium hic sit. Voluptas velit tenetur sunt dolorem iure et repellat."
5,assumenda,0,"Iste est quis quam veniam quae nihil quisquam. Enim sunt aut ea vel nesciunt officia fuga. Dolore atque quas deserunt dignissimos. Libero qui assumenda id fugit hic."
6,ea,479,"Nam ut ipsum fuga non voluptatibus dolores. Consequuntur et asperiores aliquam dicta laborum iste. Eius expedita aut molestias optio perferendis dolorum sapiente."
7,voluptas,315,"Ullam voluptate deserunt illum aliquam necessitatibus. Esse commodi voluptate quod ea libero rerum."
8,voluptatem,8,"Hic ex non quia commodi id ut dolorem. Dolor dicta non facilis cumque aspernatur eveniet. Aliquam laboriosam omnis soluta."
9,velit,22712900,"Aliquid neque et et quas exercitationem. Id voluptas rerum eum et."
10,nam,770,"Provident libero mollitia qui eum. Quod consequatur debitis vitae distinctio. Est sed dolores voluptatum nulla vel saepe qui. Consequatur suscipit amet id dignissimos soluta ut et."
11,molestiae,6840,"Dolorum eligendi quia dolorem earum iure officiis voluptas optio. Impedit ullam assumenda rerum accusamus minima. Omnis dolor impedit natus."
12,beatae,4,"Veritatis molestiae odit quia. Voluptas omnis iure debitis et. Autem soluta numquam tempora omnis fugiat. Et ab nihil a animi ratione."
13,ouda,608,"Quis da wa la"
14,doloremque,2541670,"Cumque et quia nam omnis beatae. Omnis qui accusantium aperiam."
15,ouda,608,"bes da wa la"
16,ut,73884,"Ratione ad libero aut. Nam qui modi at eos. Nulla voluptas et distinctio error."
17,voluptas,8,"Possimus minima id ipsa praesentium. Voluptatem incidunt omnis ea dolorem excepturi adipisci quis adipisci. Rerum aut eligendi possimus mollitia. Molestiae fugit error harum corporis non natus libero."
19,temporibus,8432610,"Labore amet natus repellat explicabo eos. Amet aut commodi omnis fugit sed qui. Aliquid molestiae saepe blanditiis veritatis ut sunt aut. Quia neque corrupti eum nihil suscipit cupiditate sit vel."
21,nostrum,0,"Quia delectus ipsum qui nihil non. Perferendis atque quibusdam voluptate."
22,debitis,231821,"Consequatur quasi ea atque dolore assumenda velit ea. Facere pariatur porro amet maxime sequi aut molestiae expedita. Eum quasi enim non aspernatur recusandae pariatur. Ut qui eos alias ut."
23,sit,992693000,"Quis soluta dicta vel exercitationem error iure esse. Quos error est voluptatem error corrupti natus rem. Consequatur illo delectus adipisci quia aliquid expedita."
24,adipisci,71,"Provident suscipit est exercitationem dolor nulla voluptatibus sint. Aliquid harum aperiam molestiae eligendi. Saepe tempora ut rem voluptas perferendis. Voluptatem modi et error enim corrupti."
25,asperiores,3,"Eaque sed dolorem officiis exercitationem quia quia est. In earum fugiat numquam asperiores. Aut qui reiciendis odio illo consectetur. Ad aut dicta quam incidunt aspernatur."
27,ipsam,8,"Velit suscipit iusto alias hic incidunt aliquam sequi est. Cupiditate velit ea deleniti quia ab saepe exercitationem. Adipisci et qui consequatur possimus sit."
29,ab,73291100,"Voluptas qui dolore optio similique omnis cumque facilis. Perferendis praesentium non expedita. Rerum esse dolor quo neque."
30,magnam,151,"Illo iste et officia voluptatem. Quas in debitis quia error ab ipsa perspiciatis. Mollitia deserunt cumque praesentium possimus vero laudantium. Nobis fuga doloribus et exercitationem."
31,rerum,0,"Labore qui veniam omnis vel ut. Consequatur neque non est."
32,officia,50024,"Temporibus perspiciatis iste quod eveniet repudiandae fugiat. Amet inventore natus autem est. Rerum rem ipsum voluptate non. Cum similique est tempora et accusamus inventore."
33,distinctio,1504280,"Quis quibusdam blanditiis sapiente et. Ut autem animi laudantium culpa. Cupiditate atque ipsum quasi ipsum vero."
34,est,16461800,"Cupiditate est eaque dolores voluptatem odio rem. Corrupti nam amet reprehenderit deleniti cupiditate et. In perferendis enim et quos. Et qui commodi excepturi delectus."
35,assumenda,69403700,"Animi placeat vel sed est deleniti qui ducimus possimus. Fuga inventore placeat esse velit quidem illum. Illum aspernatur doloribus magnam ex et tempore nulla qui."
36,eum,250,"Ut et placeat porro praesentium enim at odit. Minima omnis in eum magnam possimus. Nesciunt at eligendi deserunt reiciendis aut. Itaque magnam debitis aliquam."
38,harum,52110600,"Consequatur et ut ad reprehenderit impedit maxime eaque eos. Consequatur omnis culpa eius asperiores ab odit temporibus. Nam officia rerum et id dignissimos quia quia vel."
39,et,0,"Magnam architecto rerum dolor sit iure. Quisquam consectetur beatae vel expedita. Asperiores quia non quis ea debitis quam."
40,et,274940,"Aut suscipit nihil enim est ipsam perspiciatis. Est eum est dolor qui recusandae. Cumque modi quas culpa maiores quos sit."
42,est,9029,"Sit ut tenetur dolorem sed. Similique dicta atque et est natus delectus illo. Atque iste saepe autem voluptatem."
43,ea,855,"Sunt maiores voluptas ipsam quo. Sit aperiam cupiditate ut enim ipsa unde. Odit enim nihil et ut distinctio. Reprehenderit ratione et est amet consequuntur sit praesentium rerum. Est nemo fugit odio nam maxime laborum."
45,repellendus,61350,"Consectetur veritatis tenetur iste corrupti repellat vel dolore. Quas sapiente similique commodi et ipsa vitae. Est itaque sit aut sint quaerat. Totam dignissimos velit nam soluta reiciendis itaque."
46,nobis,13701000,"Possimus aut fugiat ducimus et eaque. Neque deserunt exercitationem numquam dolorum."
47,id,27,"Provident voluptatum laborum accusantium esse sapiente. Iusto ab sit consequatur incidunt et rerum. Officiis maiores officiis eum et omnis minus."
49,tempora,995,"Qui nostrum quaerat aut repellat qui ut sequi qui. Qui et id illo et aut repudiandae eum. Quae omnis laborum esse quam velit. Labore aut culpa incidunt est odit qui recusandae."
50,ipsam,512334000,"Dicta voluptates et qui et nesciunt quaerat. Omnis maiores dicta incidunt voluptatibus ut dolor. Aliquam qui fuga repellat quasi corporis tenetur illo porro."
51,aut,0,"Autem sequi sequi dicta suscipit reiciendis id est numquam. Dicta possimus similique voluptas sint modi. Est voluptas laboriosam tempore fuga eum quis."
52,aliquid,6,"Temporibus hic ipsam repudiandae doloribus. In ullam hic veritatis laboriosam quisquam. Debitis dignissimos placeat maiores reiciendis nesciunt iure cum. Omnis ipsum iure necessitatibus aut unde alias. Excepturi aut quo ratione facere ut est at."
53,aliquid,641140,"Provident amet labore qui provident atque eum. Omnis dolores labore quis quidem. Voluptatem nostrum quis corrupti voluptatem veritatis et. Doloremque natus fugiat rerum debitis."
54,eos,6013610,"Fuga cum a quasi. Cum nihil quo aperiam corporis. Porro ut ducimus quia incidunt voluptatem."
55,est,1065,"Ut et perferendis eos dolorem. Vel sed dolorem distinctio aperiam qui corporis dignissimos perferendis. Et sit eveniet et id."
56,magni,860317000,"Quia rerum et soluta ab. Dolores aspernatur ut doloremque officiis. Quia in voluptas fuga a."
57,esse,41174,"Iste qui et cum eius. Officiis exercitationem vel aliquid. Aut delectus molestias ut nulla praesentium quia. Animi exercitationem vero nisi non reprehenderit molestias."
58,repudiandae,5,"Magnam odio facilis vero et. Quae quo et error dignissimos nulla et. Dolores aut sunt vero temporibus a."
60,quia,489,"Libero consequuntur vero voluptatem architecto omnis unde et itaque. Sit quam earum eligendi labore nesciunt. Autem assumenda voluptate excepturi dolorem vero nihil eius. Harum veniam ab voluptate ut."
61,ea,40321,"Occaecati eum et porro velit qui et. Eum vel esse voluptatem voluptate. Et laudantium pariatur repellendus fuga ipsa. Et ducimus nemo libero autem quis voluptatem ipsam."
62,facere,38068100,"Quo sed hic ducimus sint eius at. Sit velit voluptate voluptatem. Illum et ea facere unde dolor cumque. Iste eos autem non consequuntur."
64,labore,76007,"Corrupti dignissimos cumque dolorem cumque est. A molestias saepe enim a incidunt repudiandae porro. Dignissimos voluptatum at ut sed voluptate molestiae."
65,voluptas,124,"Aut quidem incidunt temporibus ut in vero quibusdam quia. Dolores nam ab molestiae et. Voluptatum eligendi praesentium corrupti nulla. Mollitia sint id maxime ducimus voluptatem cum omnis."
66,consequatur,1,"Atque autem vero nesciunt sit eum architecto suscipit rerum. Nihil dolorem alias non aliquid ipsa nulla. Eos aliquam est error animi consequatur. Repellat alias at sint tempore similique."
67,sequi,25840000,"Dignissimos ratione cum adipisci mollitia sed quod deserunt. Distinctio delectus sint sunt itaque. Nulla quod sed ratione magnam quia. Quaerat consequuntur qui dicta eos iure nobis et."
68,est,6974880,"Et voluptatem vel eos deserunt ipsa reprehenderit deserunt nobis. Harum fugit veritatis eos qui mollitia autem fugiat. Rerum voluptate veniam praesentium voluptatum cumque laboriosam rem. In aliquid consequatur et quia."
69,est,622868000,"Placeat ea sunt qui impedit. Labore sint est expedita possimus. Aut adipisci asperiores ratione voluptatem."
70,mollitia,88918,"Corrupti vitae voluptas fuga consequatur dolorem voluptatem. Iure ab nemo necessitatibus nihil facere. Aut quidem est delectus quasi fuga praesentium dolorem."
72,vitae,0,"Id sunt ut iste est ducimus placeat. Voluptatibus doloremque rerum architecto dolorem. Eveniet totam maiores quidem velit optio."
74,et,8331,"Maiores perferendis cupiditate repudiandae rerum praesentium neque. Saepe aperiam odit rerum totam labore distinctio quo aspernatur. Omnis maiores laudantium reprehenderit fugit."
76,aliquam,1652,"Recusandae voluptatibus non et saepe qui velit eum. Ipsam commodi quo soluta rem ut. Et ipsa quo temporibus est."
77,adipisci,791,"Aperiam sit rem esse. Delectus amet et tempore ipsam sapiente minus maxime. Qui deleniti in molestiae. Iste id nulla dolorem ad hic nihil. Debitis deserunt et aut vel vel rerum sit."
78,eius,801,"Quis iusto assumenda iste cupiditate. Animi explicabo quia culpa doloremque."
79,sapiente,47,"Rerum sit voluptas repellat quis quibusdam maxime. Incidunt in dolorum molestiae sit beatae sed facilis. In facere asperiores unde dolore amet."
80,aut,49276600,"Molestias sed ullam voluptatem. Ut labore velit voluptates cumque recusandae. Quos est quas nihil earum. Unde ut ullam voluptas facere molestias dolorem unde totam. Accusantium et dolore qui."
81,placeat,531784,"Aut perferendis perferendis aliquid officiis. Sequi aspernatur ducimus quia fugiat enim saepe ea hic. Qui aliquid amet recusandae ut molestiae."
82,fugit,8,"Quis iste ea sint dolorem. Dolorem sed quia expedita sed tenetur laboriosam. Culpa eum aspernatur voluptas sed rerum veniam sed. Ullam debitis non aut eum."
83,non,99,"Quam ad modi iusto natus. Eaque ipsam aspernatur sint aperiam laudantium qui. Itaque repellendus occaecati iusto ullam fugit et labore. Cumque ut tempora rerum et nemo."
84,nisi,769150,"Eum iste quo ratione illum omnis. Aspernatur cupiditate quia consequatur maxime quia magnam. Ut veniam dolorem est voluptatem autem et tempore placeat. Eaque nesciunt provident magnam eaque dignissimos illum non."
85,animi,552,"Culpa atque rerum nihil ratione et et corrupti unde. Ut aliquid ducimus doloribus reprehenderit fuga nobis quas. Veniam ea fugiat qui qui eius velit. Dolore dolores praesentium qui magni aliquam eos."
86,eum,69389700,"Vitae voluptatem aut iusto hic inventore. Voluptas rerum ab sint impedit distinctio. Itaque harum quae occaecati ipsa. Facilis quis aliquam voluptate nihil itaque. Asperiores ad sed magni."
87,minus,4,"Ex aut est qui voluptatem. Natus deleniti ut atque aliquid non. Impedit voluptas et unde est tenetur perferendis voluptates."
88,accusamus,767955000,"Minima fuga reprehenderit sit maxime quos ut rerum pariatur. Aut illum cumque autem omnis ratione assumenda. Iusto adipisci quisquam nihil accusantium non voluptates quia voluptatem. Delectus vel quibusdam non et. Fugiat et voluptatem quia aut corrupti fuga iure itaque."
89,quo,35376900,"Fuga et laborum qui veniam nihil nisi sint. Voluptatem ducimus dolorem dolor aperiam sed dolores. Qui dolorem distinctio accusantium aspernatur. Repudiandae eos eos ad architecto nulla."
90,officia,78,"Repellat eaque adipisci possimus sed ut aperiam illo. Aut ab sint ducimus."
91,qui,56033,"Dolores natus natus totam hic. Fugit sit necessitatibus tempore et provident. Consequuntur harum omnis ut maiores voluptate assumenda. A laborum sed et possimus aut esse."
92,culpa,45758200,"Nulla quo dolorum et. Corrupti et illo illum dolor. Minima nisi qui vel quam. Animi optio culpa quisquam. Eaque asperiores et iste."
93,qui,882,"Dolorem exercitationem ut labore hic. Reiciendis inventore nulla ducimus soluta voluptatum nulla. Et soluta quia sunt. Ducimus nostrum inventore officiis non."
94,sint,3,"Et minima ut impedit asperiores ea. Quod consectetur labore eius maxime repudiandae sed. Occaecati est vel quia officia cumque dolores non."
95,vero,4099410,"Ipsam nulla voluptatem hic voluptatem dolor adipisci qui. Ab commodi eaque praesentium possimus. Ut quos voluptatem delectus placeat laboriosam occaecati iusto."
98,ea,358,"Sed animi quia architecto quo consequuntur eum. Quo in ut qui quia architecto fugiat. Non explicabo sed consequatur accusantium voluptatem."
99,itaque,5,"Numquam iusto blanditiis quia quasi asperiores possimus exercitationem. Consectetur veritatis deleniti sit ut reprehenderit illo dolor. Earum aut sint voluptate dolor autem."
104,illo,0,"A earum non animi est suscipit hic eius. Laudantium illo porro dolorem voluptatem non. Quas voluptate ea necessitatibus quia modi. Unde deleniti excepturi eos ut fugiat qui quas."
113,consequuntur,726503,"Iusto a ut expedita impedit velit. Aut est consequatur accusamus rerum perspiciatis sequi. Asperiores distinctio voluptas eum vitae. Optio in porro blanditiis odit."
121,porro,8239,"Similique fugit consequatur ut voluptas dolorem nobis. Molestias sequi necessitatibus sed harum qui quia. Recusandae quos dolorem omnis quas porro tempora vero. Debitis aut omnis est molestias enim sit voluptas."
180,eos,500966,"Facilis est sit aut exercitationem. Sequi at qui neque eos quaerat. Labore laudantium et molestiae quis id sit."
187,quia,741,"Qui est corporis animi eos eos. Libero beatae sint delectus repellat quasi. Consequuntur cupiditate architecto nostrum in quo."
213,esse,81061000,"Qui quos nemo molestias. Voluptates eum consequuntur ipsum natus dolor eum voluptates. Sed illo vitae quam magni. Nisi vel neque assumenda quasi reiciendis. Sit aut quia consectetur amet."
214,recusandae,0,"Non ab dolor molestias voluptas tempore. Sed laborum et tempore autem deserunt. Ut qui illum minima aut vel quis est dignissimos. Eveniet optio aut autem dolores nulla non."
218,voluptas,369416000,"Cumque dolore dicta in architecto quasi consequatur consequatur. Qui corrupti error in ut. Et voluptatem beatae ex ut tempora provident minima."
231,ea,6,"Quidem beatae delectus at quis. Sapiente voluptatem amet autem ut. Aut nobis odit et."
238,consequatur,411,"Voluptatem cupiditate quam officia commodi consectetur illum. Et minima enim consequatur beatae sunt odit reprehenderit. Recusandae ullam similique autem. Et placeat iste aut omnis ullam consequuntur vel."
243,autem,6209730,"Deserunt autem minima ut qui. Repellat doloribus aut molestias sint sed voluptates et rerum. Ad vel voluptatem officia explicabo. Hic maiores et tempore blanditiis aut. Accusantium cumque quibusdam beatae eveniet molestiae quod facere."
244,eligendi,5353920,"Minima nihil tenetur quo porro qui inventore. Doloribus est illum sed dolores corporis et vel."
246,nihil,81,"Et culpa eum quod libero quasi ea similique. Suscipit asperiores quaerat dignissimos quia."
250,perferendis,24,"Alias fugit mollitia rem unde inventore ex dolorum. Odio nisi soluta sint quam et earum sint tempora."
265,eius,4807680,"Commodi libero velit adipisci quas sit ut maiores hic. Suscipit iste dignissimos architecto reprehenderit commodi quae. Incidunt natus voluptatibus quam fugiat ipsum ea."
287,alias,3567,"Nihil cum est natus laborum asperiores. Molestiae placeat voluptatem enim est quaerat sunt. Ipsum veritatis quod consequatur omnis provident aliquam qui rerum. Eum ex non magnam temporibus debitis. Et et voluptate similique error."
291,soluta,0,"Atque reiciendis repellendus quia et dolorum occaecati. Recusandae debitis in eos voluptas eaque. Nulla nihil quasi vitae dolores est."
322,saepe,645155000,"Et porro eos ut repudiandae qui. Eveniet consequatur ut consectetur ducimus ab ipsum. Qui reiciendis quia aut qui excepturi labore nemo."
327,a,992690,"Accusantium atque amet ullam aut iste. Facere est nesciunt impedit doloremque optio sit possimus. Perspiciatis velit vero vel et consequatur."
328,consequatur,1117,"Velit asperiores eius illum vitae quis doloremque. Nemo et aliquid sed magni. Quia ducimus id doloribus dolorum. Maxime eligendi aut consequuntur corrupti."
331,eius,58074700,"Expedita eligendi est voluptatem provident officiis amet placeat. Recusandae enim ab placeat iusto et qui. Vel expedita nihil officia. Repellendus et nemo corporis quos odit. Fuga odit iusto libero consequatur."
336,ut,0,"Velit placeat tempora culpa beatae voluptatem. Animi nobis perferendis saepe consequatur quia et."
347,et,4642640,"Sed esse placeat repellendus accusantium est sunt molestiae. Error tempora eligendi quod qui ut dolores qui. Labore molestias quasi dignissimos nemo ratione. Et odit ut quasi eveniet nihil consequuntur et. Autem qui dolores nam voluptate ad consequuntur ullam."
350,enim,8,"Alias non assumenda non quis vero. Sapiente ipsum assumenda commodi cum consectetur eos. Et reiciendis quia distinctio dolor error et laborum qui. Placeat saepe dolorum qui."
353,incidunt,90427800,"Magnam cum qui neque sit ipsa veritatis. Facilis et pariatur non quod nisi voluptatem. Unde minus aut rerum sit omnis."
356,error,305977000,"In et beatae beatae modi est. Consectetur expedita incidunt ab officia dolore. Quis aliquam aperiam quam ut unde iusto. Non quia voluptatum quos ullam."
357,quo,20,"Corporis quia possimus accusantium eum qui amet adipisci. Distinctio voluptatibus distinctio perferendis laudantium ut."
362,exercitationem,665,"Voluptatem corporis eligendi aperiam quae unde reiciendis sint. Sit deserunt sed illo. Nesciunt dolor vel ducimus et laborum. Soluta inventore ad sint suscipit fuga occaecati."
370,doloribus,3,"Voluptas possimus doloremque ipsum et. Quibusdam et officia veritatis voluptatem veniam excepturi possimus. Quibusdam nostrum odio occaecati dolorem illum."
377,et,79978700,"Et impedit itaque doloremque ut error perspiciatis. Nesciunt a nihil laboriosam quia ducimus labore eveniet et. Ut quis sunt iste numquam consectetur possimus qui."
380,sed,79,"Quod est laboriosam tempora. Cupiditate sed quas qui aperiam iusto et illo. Quia dolorem est odit assumenda ut consectetur doloribus quidem."
383,explicabo,75054,"Sit sed omnis dolorem minima porro omnis sed. Ea quam aut qui et at necessitatibus velit aspernatur. Mollitia maxime consequatur qui. Sit minus incidunt est iusto eveniet qui eos. Ipsa qui iure nihil."
386,perferendis,340,"Nesciunt atque neque cum id iusto quibusdam cumque. Neque et itaque temporibus vitae eum animi molestiae. Sint repudiandae ut natus voluptatem iste."
388,ut,4272560,"Non harum saepe est velit consequuntur. In possimus nam aut eum voluptas eaque ipsam consequatur. Quas ut ullam hic enim nisi. Et harum dolorem sed minima quo."
392,totam,0,"Soluta necessitatibus eligendi provident nihil vero praesentium. Aut officiis totam qui quaerat suscipit ex voluptatibus. Itaque ipsa cupiditate quo. Deleniti quas est voluptatibus sapiente."
398,recusandae,7,"Aut qui tempora dolor fugiat. Omnis velit et quia. Dolores assumenda ipsa quisquam incidunt asperiores et."
417,aliquam,942454,"Deserunt blanditiis eveniet qui nulla iure nihil. Fuga architecto aut unde qui quidem. Omnis id perspiciatis est itaque ullam aut."
438,numquam,9,"Ut sapiente commodi eaque explicabo non. Quis deleniti reprehenderit nisi est non. Veniam nihil voluptatum corporis qui est quas. Quibusdam ut officiis eius magni quibusdam in facere."
452,quis,699505000,"Non velit sed omnis ut non. Nostrum alias rerum deserunt. Similique dolor eos aut qui est aperiam ea. Suscipit omnis quae molestiae aliquam."
455,deserunt,4014270,"Eos excepturi quaerat laudantium praesentium omnis. Nemo voluptate libero recusandae voluptatem enim. Qui veniam dignissimos animi accusantium quis modi earum. Omnis ut sed doloremque nihil tenetur."
456,tempore,0,"Et vel ratione eos et. Omnis omnis amet sapiente laudantium modi. Libero sint sint eos perspiciatis."
474,et,581040,"Ad ut veniam libero quisquam. Velit non eaque eligendi eius architecto ut. Autem quisquam omnis aut voluptatem ea."
487,maxime,4,"Est et veritatis sint. Praesentium mollitia amet rerum atque tempore qui. Id saepe voluptate distinctio."
490,quod,154,"Aut laudantium ut id vitae quidem quo voluptatem. Id architecto molestiae et aut sit iusto quo. Sunt ut nesciunt cum officia. Sequi facere molestiae dolores maxime et sit dolore aut."
501,molestiae,0,"Dolor aliquid veniam ab vitae corrupti saepe perferendis. Sint quia voluptas dignissimos suscipit. Dolorem quis et culpa veritatis sint eum."
502,animi,57319500,"Quia sunt totam nesciunt officiis officiis accusamus. Omnis est sed suscipit quia quae deleniti. Vel qui architecto a corrupti qui. Ea libero alias a nam molestias consequuntur voluptatem."
510,possimus,67557,"Quia odit molestias fugit rerum in qui. In quae odit impedit necessitatibus repudiandae placeat magni. Repellat reprehenderit iusto rem non quaerat aut. Et rem est velit cumque sed."
525,omnis,863878,"Aut cupiditate eum officiis dolores dolor earum fugit. Sint et ipsum corporis magni."
526,quae,822,"Ducimus est excepturi accusantium qui earum occaecati. Tempore nesciunt earum consequuntur culpa. Perspiciatis non at quae. Ut consequatur dolor omnis architecto deleniti nostrum."
532,non,2504,"Dolores repellat sed quidem culpa occaecati. Et aspernatur natus aspernatur ea. Doloremque quis laboriosam qui rerum. Architecto eos et et corrupti voluptatem aut."
535,a,5,"Quod est architecto esse et excepturi. Aut exercitationem modi vitae ex."
536,doloremque,4597,"Et vero nulla ut rerum rem. Velit error voluptas dignissimos eius pariatur molestiae voluptatibus. Consequatur animi et facilis."
539,consequatur,446494,"Rerum quaerat minima asperiores optio autem delectus sapiente. Laborum aut beatae nobis. Velit temporibus eos dolorum error mollitia et eligendi."
540,illum,869,"Est quis molestias temporibus dolore rem. Debitis et sapiente esse minima sequi sit. Incidunt quae accusamus amet amet molestiae voluptas."
545,et,30,"Ipsam modi aut rerum commodi incidunt. Et maiores eligendi beatae sunt. Tempore dolor provident eaque et dolorem inventore sint."
559,rem,523,"Sunt veritatis aliquid molestiae quo sequi est dolorem. Odio eaque exercitationem reiciendis. Non consequatur fuga saepe. Ducimus est quidem praesentium labore consequatur velit. Labore distinctio qui reiciendis sit cupiditate quia."
582,sunt,415140000,"Voluptatem ipsum suscipit omnis error modi nemo. Corporis laborum placeat non aliquam sapiente et. Ipsum itaque molestias commodi ut molestias pariatur qui."
588,est,219772,"Ex a quae et accusamus temporibus. Ut enim sed qui et. Et hic aliquid est."
602,sed,9438,"Magni excepturi non laudantium nam hic non. Blanditiis possimus omnis et vel commodi iure. Aut iure laudantium ipsum sed qui sapiente. Laborum totam dolorum molestiae a quia esse velit quia. Cum nulla eum quaerat enim quae atque."
604,reprehenderit,5923800,"Nisi tenetur minus ut tenetur. Dolores cum dolores quas ut. Sit enim dicta sed enim."
612,iusto,2,"Tenetur minima est sed commodi ut. Iusto consequuntur quia suscipit. Nihil porro possimus enim quis eos impedit. Officiis aliquam autem sed ad voluptas."
617,placeat,0,"Alias totam voluptas quo quidem temporibus minus dignissimos. Et expedita et laboriosam alias sapiente quam. Eum repellendus incidunt quaerat doloribus et et."
619,sunt,70,"Cupiditate vel veniam officia et est sunt. Accusamus illo eius eos deserunt. Deleniti exercitationem debitis modi voluptas nostrum occaecati corrupti ducimus. Quam nihil ea laboriosam nihil."
620,voluptatibus,82,"Tempore suscipit consequuntur unde qui. Tenetur enim ipsam ad qui. Suscipit quasi tempore non consequatur suscipit voluptas. Mollitia ut id nihil quia minima cumque aut."
631,eveniet,808,"Iure alias aut est est vel ea. Id doloremque odio dolores itaque. Porro id non nemo fuga consequatur voluptate. Voluptate quia beatae ipsum qui aliquid sequi."
634,iure,747865000,"Nobis vel aut aperiam repellendus aspernatur ut sed. Molestiae voluptatem veniam qui voluptas excepturi consequatur. In in facere dicta."
635,possimus,182769000,"Et corporis alias nihil sequi id. Molestiae officiis omnis molestiae magni iste. Dolor velit quos molestiae qui mollitia ea. Aut ea quas cumque alias. Perspiciatis cum excepturi incidunt omnis et et temporibus voluptatem."
638,omnis,0,"Repellat veritatis nam ullam omnis perspiciatis deleniti perferendis. Totam quasi dolores culpa fuga iure vel velit. Itaque et earum et inventore. Corrupti consequuntur ut sunt placeat quibusdam consequatur."
